"data","zrodlo","tytul","tresc","link"
"2026-03-25","PAP","Wiceminister klimatu: będą skrócone procedury przy inwestycjach w wiatraki na morzu i lądzie","Procedury administracyjne dotyczące inwestycji w morskie farmy wiatrowy będą skrócone do 2 lat, a w lądowe do 1 roku - zapowiedziała w środę wiceminister klimatu Urszula Zielińska. Wiceminister klimatu i środowiska Urszula Zielińska podczas V Polskiego Kongresu Klimatycznego odczytując list minister Klimatu i środowiska Pauliny Hennig- Kloski stwierdziła, że „nie ma suwerenności energetycznej bez odchodzenia od paliw kopalny, nie ma stabilności gospodarczej bez przewidywalnych, odnawialnych źródeł energii (OZE)”. - Rozumiem, że transformacja budzi obawy, pojawiają się pytania o koszty transformacji energetycznej, stabilność systemu, akceptację społeczną (...) ale odpowiedzią nie jest zatrzymanie tych zmian, i nie jest spowolnienie zmian, ale ich mądre zaprojektowanie i przeprowadzenie z akceptacją społeczną.(...)- mówiła Zielińska. Dodała, że rozproszone odnawialne źródła energii, energetyka obywatelska samorządowa, lokalna(...) to większa odporność na kryzysy energetyczne, takie jak ten wywołany przez konflikt na Bliskim Wschodzie i szoki cenowe.- Widzimy jak często te kryzysy dotykają nasze rynki, musimy się na to uodpornić. Poprzedni był w latach 2022-2023. - podkreśliła. Zielińska: konkurencyjność gospodarki i polityka klimatyczna nie stoją ze sobą w sprzeczności Zdaniem Zielińskiej konkurencyjność gospodarki i polityka klimatyczna nie stoją ze sobą w sprzeczności. - We wszystkim potrzeba zdrowego rozsądku. Nie możemy zabić naszego przemysłu tylko ze względu na zieloną energię i pozyskiwanie zielonej energii. Biznes (...) musi zarobić na to, żeby nas stać było na tę zieloną energię - powiedział wiceprezes Orlenu Witold Literacki. Zwrócił uwagę, że jest z „brudnego biznesu”. - Ale to te pieniądze zarabiają na to, by można było tę czystą energię produkować - zaznaczył. Literacki zwrócił uwagę, że przemysł przenosi się poza UE, gdzie regulacje klimatyczne nie sięgają, niejako eksportując CO2.- Tam się ludziom polepszy, zarobią sobie na panele fotowoltaiczne, będą instalować wiatraki, a my stracimy szansę na zarobienie pieniędzy tutaj - dodał. - Dopóki takie spółki jak Orlen (...) prywatne spółki na rynku polskim nie będą w tych obszarach nowych technologii widziały jasnej, dochodowej ścieżki rozwoju swojego biznesu, dopóty spać spokojnie nie możemy - stwierdziła wiceminister. Zaznaczyła, że może warto, by państwo zainwestowało trochę więcej, żeby to Orlen i inne spółki rozwijały nowe technologie, ale w Polsce - mówiła Zielińska. Zapowiedziała skrócenie wszystkich procesów administracyjnych, aby ułatwić firmom inwestowanie w odnawialne źródła energii. - Tak żeby one nie trwały dłużej niż do 2 lat maksymalnie na morzu (morskie elektrownie wiatrowe) i do 1 roku na lądzie (lądowe elektrownie wiatrowe). Tego wymaga od nas Komisja Europejska, tego wymaga od nas dyrektywa Red III. To jest dla nas absolutnym priorytetem - podkreśliła wiceminister. Poinformowała, że projekt ustawy w tej sprawie wychodzi właśnie ze Stałego Komitetu Rady Monistów do Rady Ministrów. Wiceprezes Polskich Sieci Elektroenergetycznych (PSE) Agnieszka Okońska zwróciła z kolei uwagę, że pieniądze, które będą wydawane na energetykę to w dużej mierze inwestycje spółek dystrybucyjnych i PSE. Na koniec obciążą klienta końcowego. - Jest, więc olbrzymim wyzwaniem dla spółek sieciowych, żeby inwestycje, które będziemy realizować w najbliższych latach były nieprzewymiarowane. Przy dzisiejszym rozwoju technologio trudno planować na 40 lat do przodu, a inwestycje w sieci elektroenergetyczne amortyzują się przez 40 lat. To co zbudujemy dziś będzie lądowało w rachunku końcowym (odbiorców energii) przez 40 lat - wskazała Okońska. Podkreśliła, że niezwykle istotne jest, więc to, żeby pobudzić rozwój biznesu na północy Polski, by duże odbiory energii miały miejsce tam gdzie powstają duże źródła wytwórcze. W tym rejonie Polski w budowane są morskie farmy wiatrowe i większość lądowych. Tam też ma powstać pierwsza w Polsce elektrownia jądrowa. Obecnie najwięcej przemysłowych odbiorców znajduje się jednak na południu kraju. - Chcemy pobudzać rozwój przedsiębiorstw dużych odbiorców energii na północy kraju, żebyśmy nie usieli budować autostrady typu most HVDC (system przesyłu wysokiego napięcia prądu stałego) z północy na południe i żebyśmy nie musieli tą autostradą energetyczną przepychać produkowaną na północy energię na południe - powiedziała wiceprezes PSE. Podkreśliła jednocześnie, że za sprawą inwestycji PSE sieć przesyłowa energii w Polsce już się podwoiła. - Kolejne dziesięć lat to jest jej zwiększenie o 1/3 - dodała Okońska. Literacki: będziemy robić wszystko żeby jak najwięcej kupować w kraju z naszej rodzimej produkcji Zdaniem wiceprezesa Orlenu, jeżeli firmy mają inwestować w transformację energetyczną, to trzeba to zrobić z jak największym polskim udziałem. - Będziemy robić wszystko żeby jak najwięcej kupować w kraju z naszej rodzimej produkcji. Jeżeli wydajmy rocznie 36-38 mld zł na inwestycje warto by było, żeby te pieniądze w jak największym stopniu zostały w kraju - ocenił Literacki. Dodał, że po to Orlen organizuje spotkania z lokalnymi producentami. - Pierwsze spotkanie odbyło się w Szczecinie, będą się one odbywały w innych miastach po to, żeby zapoznać ich z tym, jak będą odbywały się procesy zakupowe w Orlenie, by mogli uczestniczyć w przetargach - poinformował. Wiceprezes Orlenu zwrócił również uwagę, że strategia wydatków na inwestycje w transformację energetyczną musi być przemyślana i należy skoordynować to, na jakie źródła będą przeznaczane pieniądze. - Mówimy przecież o 1 bln zł, który ma być zainwestowany w najbliższych latach. Od drugiej wojny światowej nie było takiego boomu inwestycyjnego. To musi być bardzo przemyślana strategia, w której strona rządowa musi uczestniczyć, ze względu na to, że każda z firm spółek skarbu państwa może mieć swoje ambicje - stwierdził Literacki, wyjaśniając, że na przykład każda z nich zechce posiadać farmy wiatrowe, niezależnie od tego, czy one będą potrzebne akurat w danym miejscu. (PAP) ab/ drag/gn/","https://www.pap.pl/aktualnosci/wiceminister-klimatu-beda-skrocone-procedury-przy-inwestycjach-w-wiatraki-na-morzu-i-0"
"2026-03-25","PAP","Bliski Wschód. USA nasilają działania dyplomatyczne, brak „pozytywnej” reakcji Teheranu","USA przekazały Iranowi, za pośrednictwem Pakistanu, propozycję zakończenia trwającej od prawie miesiąca wojny. Przedstawiciel Teheranu, cytowany przez Reutersa, stwierdził jednak, że reakcja Iranu na amerykańską propozycję „nie jest pozytywna”. W reakcji na działania USA spadają ceny ropy i gazu. Jak podał we wtorek dziennik „New York Times”, a w środę potwierdziła agencja Reutera, Pakistan przekazał Iranowi propozycję Stanów Zjednoczonych w sprawie zakończenia konfliktu. Propozycja, która zawiera 15 punktów, nie została upubliczniona; według mediów zawiera ona m.in. ograniczenia sankcji, wycofanie się Iranu z programu jądrowego, ograniczenie przez Teheran liczby rakiet i wsparcia dla grup zbrojnych w regionie, a także otwarcie kluczowej dla transportu ropy i gazu cieśniny Ormuz. 15-punktowy plan USA W ocenie „NYT” przekazanie Iranowi 15-punktowego planu sygnalizuje chęć szybkiego zakończenia wojny przez Biały Dom . Jednak cytowany w środę przez Reutersa przedstawiciel irańskich władz ocenił, że wstępna reakcja Teheranu na amerykański plan „nie jest pozytywna” . Wcześniej irańska Press TV, powołując się na przedstawiciela władz, podała, że Iran zapoznał się z propozycjami USA i uznał zawarte w nich warunki za przesadne. Według doniesień dziennika „Wall Street Journal” władze w Teheranie domagają się zamknięcia amerykańskich baz wojskowych w Zatoce Perskiej i zakończenia ataków Izraela na libański Hezbollah jako warunków zawieszenia broni. Iran żąda również reparacji i zniesienia wszelkich sankcji. Wciąż trwa wymiana ognia między walczącymi stronami. Izraelska armia powiadomiła, że zaatakowała jedyne w Iranie centrum rozwoju technologii okrętów podwodnych i systemów wsparcia irańskiej marynarki wojennej w Isfahanie. W nocnych nalotach na południu Libanu zginęło co najmniej dziewięć osób. Portal Times of Israel poinformował w środę, że rząd Izraela pozwolił armii na powołanie do służby do 400 tys. rezerwistów w związku z trwającymi konfliktami z Iranem i wspieranym przez Teheran szyickim Hezbollahem; poprzedni, zatwierdzony w grudniu, limit wynosił 280 tys. Z kolei lider Hezbollahu Naim Kassem wezwał rząd Libanu do cofnięcia decyzji o zakazie działalności militarnej tego wspieranego przez Iran ruchu. Irański analityk ostrzega: Teheran gotów zająć wybrzeża Bahrajnu i ZEA Irański Korpus Strażników Rewolucji Islamskiej (IRGC) przekazał w środę rano, że w nocy siły irańskie ostrzelały cele w Izraelu, Bahrajnie, Kuwejcie i Jordanii. Irański analityk ds. bezpieczeństwa narodowego Morteza Simiari ostrzegł w wywiadzie dla państwowej telewizji, że Teheran jest gotów przejąć wybrzeża Bahrajnu i Zjednoczonych Emiratów Arabskich (ZEA), jeśli USA „popełnią jakikolwiek błąd” w regionie. Iran wciąż blokuje cieśninę Ormuz, przez którą przechodzi około 20 proc. światowych dostaw ropy naftowej i gazu ziemnego . We wtorek stacja CBS przekazała, że amerykański wywiad wykrył w cieśninie dwa typy min morskich, które miał rozstawić IRGC. Władze Iranu poinformowały we wtorek państwa członkowskie Międzynarodowej Organizacji Morskiej (IMO), że statki, których „nie uzna za wrogie”, mogą przepływać przez cieśninę Ormuz, o ile będą koordynować tranzyt z władzami w Teheranie. Kryzys energetyczny Blokada Ormuzu spowodowała gwałtowny wzrost cen energii na świecie. W reakcji na gotowość USA do zakończenia konfliktu ceny ropy mocno spadły w środę; również ceny gazu w Europie zanotowały wyraźny spadek, choć są nadal o około 60 proc. wyższe niż przed wybuchem konfliktu na Bliskim Wschodzie. Orlen obniżył w środę ceny hurtowe paliw, w tym benzyny bezołowiowej Eurosuper 95 o 30 zł za metr sześc., a oleju napędowego Ekodiesel o 118 zł za metr sześc. Jak zapewnił dyrektor Międzynarodowej Agencji Energetycznej (MAE) Fatih Birol, agencja jest „gotowa do podjęcia dalszych działań”, mających na celu uwolnienie dodatkowych rezerw ropy naftowej, „jeśli i gdy będzie to konieczne”. Na początku marca MAE poinformowała, że państwa członkowskie uwolnią 400 mln baryłek ropy naftowej ze swoich rezerw, aby złagodzić skutki wojny. Szefowa Europejskiego Banku Centralnego (EBC) Christine Lagarde oświadczyła w środę, że jest gotowa do działań, w przypadku gdy rosnące w wyniku wojny z Iranem ceny energii będą znacząco napędzać inflację. Wojna USA i Izraela z Iranem trwa od 28 lutego. Teheran w odpowiedzi atakuje Izrael i kilka państw Zatoki Perskiej, uderzając zarówno w położone tam bazy amerykańskie, jak i obiekty cywilne. (PAP) mrf/ kar/ ppa/","https://www.pap.pl/aktualnosci/przedstawiciel-wladz-iranu-o-propozycjach-usa-wstepna-reakcja-nie-jest-pozytywna"
"2026-03-24","Bankier","Solidarność na głodówce w kopalni Orlenu. Trzech protestujących trafiło do szpitala","W poniedziałek w ciągu dnia do szpitala zostało zabranych dwóch z czterech pracowników prowadzących głodówkę, a na ich miejsce do protestu przystąpili inni pracownicy. Wieczorem do szpitala trafił trzeci uczestnik protestu. - Obecnie z pracowników, którzy od początku prowadzili protest, zostałem tylko ja, ale ze mną jest już czterech innych kolegów. Trzej to ci, którzy zajęli miejsca zabranych do szpitala i jeden na wypadek, gdybym nie był w stanie dalej uczestniczyć w głodówce - powiedział Gawęda. Protest głodowy w IKS „Solino” rozpoczął się 15 marca, a w minioną sobotę zdecydowano o jego zaostrzeniu poprzez nieprzyjmowanie jakichkolwiek płynów. Uczestniczą w nim związkowcy z Solidarności, który jest jednym z pięciu związków zawodowych działających w firmie, zatrudniającej 250 osób. Związkowcy, rozpoczynając protest, skierowali pisma do premiera i ministra energii, w których podkreślili, że ma miejsce degradacja zaplecza technologicznego i przemysłowego służącego do wydobywania soli do produkcji sody. Zaapelowali o pilne działania i spotkanie. Wśród ich postulatów znalazły się: przejęcie przez państwo kontroli nad strategicznymi aktywami związanymi z produkcją sody, soli oraz systemami magazynowania, przygotowanie rządowego programu dla kompleksu energetyczno-solnego na Kujawach obejmującego zagospodarowanie złóż Łanięta, Lubień i Damasławek, budowa warzelni, powołanie spółki celowej do realizacji programu bezpieczeństwa solno-magazynowego państwa. IKS „Solino” są spółką akcyjną Grupy Orlen. Po rozpoczęciu protestu biuro prasowe Orlenu informowało, że strona protestująca od kilku miesięcy ignorowała zaproszenia na rozmowy z zarządem spółki. „W latach 2025–2026 nie podjęto decyzji o redukcjach etatów ani programach dobrowolnych odejść. (...) Wbrew pojawiającym się informacjom, spółka nie ogranicza również zdolności produkcyjnych lub magazynowych ani nie likwiduje infrastruktury produkcyjnej, lub służącej magazynowaniu, a wręcz przeciwnie, rozwija je. Jeśli chodzi o złoża Łanięta, Lubień i Damasławek, Solino nie posiada koncesji na ich zagospodarowanie” - podał Orlen. Dyrektor Departamentu Komunikacji Ministerstwa Aktywów Państwowych Przemysław Kuk informował, że protest został rozpoczęty bez jakichkolwiek rokowań czy próby mediacji. - IKS Solino realizuje i przygotowuje inwestycje o strategicznym znaczeniu dla bezpieczeństwa energetycznego państwa oraz stabilności infrastruktury magazynowej. Spółka konsekwentnie rozwija i modernizuje kawernowe magazyny ropy i paliw, prowadząc projekty związane z unowocześnianiem infrastruktury powierzchniowej i podziemnej oraz podnoszeniem poziomu bezpieczeństwa procesowego - wskazał Kuk. (PAP) rau/ mmu/ mhr/","https://www.bankier.pl/wiadomosc/Solidarnosc-na-glodowce-w-kopalni-Orlenu-Trzech-protestujacych-trafilo-do-szpitala-9102940.html"
"2026-03-24","Bankier","Orlen obniżył hurtowe ceny paliw","Według aktualnego cennika hurtowego Orlenu, Ostatnia, sobotnia zmiana cen hurtowych Orlenu dla obu tych podstawowych paliw, w porównaniu do dnia poprzedniego, czyli piątku, 20 marca, obejmowała niewielki spadek w przypadku benzyny bezołowiowej Eurosuper 95, wynoszący 6 zł - z 5 739 zł do 5 733 zł za metr sześc., natomiast w przypadku oleju napędowego Ekodiesel był to znaczny wzrost, bo aż o 521 zł - z 6 737 zł do 7 258 zł za metr sześc. Wtedy benzyna bezołowiowa Eurosuper 95 staniała tam o 94 zł - z 5 272 zł do 5 178 zł za metr sześc., a olej napędowy Ekodiesel o 164 zł - z 6 359 zł do 6 195 zł za metr sześc. Była to pierwsza obniżka w koncernie od wybuchu wojny na Bliskim Wschodzie 28 lutego, gdy w kolejnych dniach po ataku USA i Izraela na Iran oraz w związku blokadą Cieśniny Ormuz ceny ropy naftowej na świecie, a także paliw gotowych, zaczęły rosnąć. Po korekcie z 10 na 11 marca Orlen obniżał jeszcze ceny paliw, ale spadki były już niewielkie, w przypadku benzyny bezołowiowej Eurosuper 95 z 17 na 18 marca o 14 zł - z 5 562 zł do 5 548 zł za metr sześc., i w tym samym czasie oleju napędowego Ekodiesel o 12 zł - z 6 577 do 6 565 zł za metr sześc., a wcześniej, z 11 na 12 marca o 3 zł - z 6 195 zł do 6 192 zł za metr sześc. Według hurtowego cennika paliw Orlenu , nie mogąc działać na szkodę firmy, natomiast inne instrumenty kształtowania ceny są w rękach państwa. Wskazał przy tym, że potencjalnie rozpatrywana jest kwestia akcyzy czy VAT. - Nie mieliśmy do czynienia z takim zamieszaniem, z tak wielkim kryzysem chyba nigdy - stwierdził Balczun. Zapytany, czy w związku z tym Orlen zostanie obłożony specjalnym podatkiem, czy zejdzie z marży, stwierdził, że Orlen cały czas podejmuje działania takie, żeby minimalizować skutki dla społeczeństwa tych wzrostów (cen paliw). - W związku z tym minimalizuje swoją marżę detaliczną na tyle, ile się da, oczywiście nie mogąc działać na szkodę firmy. Inne instrumenty są w rękach państwa - podkreślił szef resortu aktywów państwowych, odnosząc się do Orlenu. I dodał: - To, co dla nas jest kluczowe to zabezpieczenie dostaw, stabilności tego, żeby nie było braków na stacjach benzynowych. Po ataku USA i Izraela na Iran Orlen zapewnił, że dostawy ropy naftowej trafiają do jego rafinerii zgodnie z harmonogramem. Podkreślił przy tym, że dzięki dywersyfikacji kierunków dostaw ograniczył ryzyko związane z niestabilną sytuacją na Bliskim Wschodzie. Koncern ogłosił też 9 marca, że jego marża na olej napędowy została obniżona z 25 gr, „niemal do zera”, aby ograniczyć skutki gwałtownego wzrostu cen paliw na świecie. W tym czasie Orlen podał też, że We wtorek, jak informują maklerzy, ceny ropy naftowej znów rosną, odrabiając poniedziałkowe gwałtowne spadki - powodem wzrostów są obawy o możliwe wciągnięcie innych państwa na Bliskim Wschodzie w wojnę z Iranem. Baryłka ropy West Texas Intermediate w dostawach na V kosztuje na NYMEX w Nowym Jorku 91,08 USD - wyżej o 3,35 proc. Z kolei ropa Brent na ICE na V jest wyceniana po 102,71 USD za baryłkę, wyżej o 2,77 USD. „The Wall Street Journal” podał, że Arabia Saudyjska i Zjednoczone Emiraty Arabskie podjęły kroki, które mogą zmierzać do przyłączenia się do wojny z Iranem, a to może potencjalnie sygnalizować nasilenie walk. W poniedziałek ropa Brent staniała o 11 proc. po tym, jak prezydent USA Donald Trump zdecydował o odroczeniu o pięć dni zapowiadanych wcześniej ataków na irańskie elektrownie w związku z blokadą cieśniny Ormuz. (PAP) mb/ mrr/","https://www.bankier.pl/wiadomosc/Orlen-obnizyl-hurtowe-ceny-paliw-9103106.html"
"2026-03-24","Bankier","Akcyza, VAT czy marże? Rząd szuka sposobu na zahamowanie wzrostu cen paliw","""W czasie posiedzenia Rady Ministrów też były omawiane (...) scenariusze związane z cenami paliw. Te scenariusze są bardzo precyzyjnie analizowane. W zależności od tego, jak sytuacja na rynkach paliw będzie się rozwijać, bo jest oczywiście bardzo zmienna, widzimy, jak zmieniają się ceny baryłki ropy naftowej na rynkach światowych. Też nie wiemy, jakie będą kolejne decyzje związane z trwającą wojną w Iranie, to po tych szczegółowych analizach ministrowie będą w najbliższych dniach podejmować odpowiednie decyzje"" - powiedział Szłapka. Równolegle w Londynie . Minister Aktywów Państwowych Wojciech Balczun informował z kolei w poniedziałek, że rząd analizuje w zakresie cen paliw kwestie akcyzy, VAT-u a także dyskutuje o ustawie o nadmiernych zyskach. Od 12 marca Orlen wprowadził promocję na benzynę i olej napędowy oraz obniżył z 25 groszy ""niemal do zera"" marżę na diesla, co ma ograniczyć skutki gwałtownego wzrostu cen paliw na świecie spowodowanego przez działania zbrojne w Zatoce Perskiej i zablokowanie Cieśniny Ormuz. (PAP Biznes) tus/ asa/","https://www.bankier.pl/wiadomosc/Rzad-omawial-we-wtorek-scenariusze-dot-cen-paliw-decyzje-zalezne-od-przebiegu-wojny-rzecznik-9103364.html"
"2026-03-24","Bankier","Sesja na GPW: korekta oczekiwań na pokój, spadki indeksów i rajd Trans Polonii","O ile poniedziałek rozpoczął się od paniki na rynkach, by w dalszej części dnia przejść w stan euforii po wpisie prezydenta USA o krokach w kierunku zakończenia wojny z Iranem, o tyle wtorek skorygował oczekiwania inwestorów. Podczas gdy Donald Trump mówił o idących w dobrym kierunku negocjacjach z Republiką Islamską, miało nie dojść dotąd do żadnych rozmów. Wysoko postawione źródła agencji Reutera w Teheranie, ujawniły dziennikarzom, że ich kraj zamierza stawiać twarde warunki negocjacyjne i chce zażądać od Stanów Zjednoczonych ""znaczących ustępstw"". Kurs Iranu miał usztywnić się przez umocnienie w kraju władzy Korpusu Strażników Rewolucji Islamskiej. Światowe indeksy prezentowały we wtorek mieszany obraz. Na giełdach azjatyckich w większości przypadków obserwowaliśmy odreagowanie po poniedziałkowych spadkach. Nikkei umocnił się o 1,43 proc. a Hang Seng i KOSPI zwyżkowały o odpowiednio 2,74 i 2,79 proc. Na amerykańskich giełdach dzień rozpoczął się spadkami. Gdy na GPW kończył się handel, S&P500 i Nasdaq traciły odpowiednio 0,16 proc. i 0,62 proc. Niemiecki DAX znajdował się w tym czasie w pobliżu punktu odniesienia, a CAC40 umacniał się 0,43 proc. WIG20 stracił 0,82 proc., schodząc do 3241,42 punktów, co stanowiło najniższe w tym roku zamknięcie sesji. WIG zniżkował o 0,88 proc. Jeszcze większą przecenę zaliczył indeks średnich spółek MWIG40, który stracił 1,24 proc. O 0,37 proc. spadł we wtorek SWIG80. Obroty na szerokim rynku zostały podsumowane na blisko 2,2 mld zł, z czego za 1,84 mld zł odpowiadał handel akcjami spółek z indeksu WIG20. W indeksie blue chipów GPW sesję na plusie zakończyły jedynie 3 spółki: Żabka (+2,28 proc.), Orlen (+1,87 proc.) i Pepco (+0,79 proc.). Najmocniej przecenione w indeksie WIG20 zostały akcje CD Projektu (-3,57 proc.) i Allegro (-2,56 proc.). Dużym obciążeniem dla WIG20 były papiery największych polskich banków. PKO BP zniżkował o 2,04 proc., a Alior Bank wycofał się 2,06 proc. 1,64 proc. w dół powędrowały akcje Pekao. O 4,4 proc. potaniały we wtorek akcje GPW, która podała . Giełda podkreśliła, że ubiegły rok był dla niej rekordowym pod względem przychodów i zysków. Te drugie wzrosły w IV kw. o ponad 30 proc. rok do roku, osiągając poziom 204,7 mln zł. Wartość obrotów sesyjnych na głównym rynku GPW wyniosła 470,3 mld zł, co oznacza wzrost rok do roku o 41,9 proc. Mimo to spółka należała tego dnia do najsłabszych ogniw w indeksie MWIG40. Z negatywną reakcją rynku spotkały się również (-6,55 proc.). Skorygowana EBITDA okazała się o 11 proc. niższa od konsensu prognoz analityków i o 35 proc. niższa niż rok temu. Inwestorów nie udobruchała zapowiedź 10 zł dywidendy na akcję (o ponad 5 zł mniej niż w ubiegłym roku). 25,88 proc. w górę poszły we wtorek notowania Trans Polonii - spółki transportowej, która poinformowała o złożeniu oferty przejęcia nieujawnionego z nazwy znacznie większego gracza z branży. Spółka planuje pozyskać finansowanie m.in. poprzez banki, PFR i fundusze private debt, unikając emisji. , podczas gdy Trans Polonia była wyceniana po wtorkowej sesji na 320 mln zł. Jeszcze większą procentową zwyżkę osiągnęły akcje Pure Biologics, które zyskały aż 38,78 proc. 24 marca spółka opublikowała komunikat ESPI, w którym podała, że uzyskane wyniki badania kandydata na lek pomocny w walce z nowotworami, oraz wspierają zasadność dalszego rozwoju klinicznego projektu. MM","https://www.bankier.pl/wiadomosc/Sesja-na-GPW-korekta-oczekiwan-na-pokoj-spadki-indeksow-i-rajd-Trans-Polonii-9103456.html"
