"data","zrodlo","tytul","tresc","link"
"2026-06-22","Bankier","Baltic Power w końcowej fazie realizacji. Zainstalowano 50 z 76 turbin","Baltic Power, wspólny projekt morskiej farmie wiatrowej grupy Orlen i Northland Power, wchodzi w końcowy etap realizacji, zainstalowano dotąd 50 z 76 turbin - podał Orlen w komunikacie prasowym. Jak podano, trwają kluczowe testy infrastruktury oraz przygotowania do przekazywania energii do krajowej sieci elektroenergetycznej. Wcześniej zakończono instalację wszystkich 78 fundamentów wraz z elementami przejściowymi. Orlen poinformował, że gotowe do rozruchu są obie morskie stacje elektroenergetyczne oraz lądowa infrastruktura przyłączeniowa. Funkcjonuje również baza serwisowa, która po uruchomieniu farmy będzie wspierać jej codzienną eksploatację. Równolegle do montażu kolejnych turbin realizowane są prace, które umożliwią integrację infrastruktury morskiej i lądowej z krajową siecią elektroenergetyczną oraz przeprowadzenie próbnego przesyłu energii. ""Instalujemy kolejne turbiny i prowadzimy zaawansowane prace kablowe. Jednocześnie realizowane są testy oraz prace rozruchowe, które pozwolą na pełną integrację farmy z krajowym systemem elektroenergetycznym. To jeden z najbardziej wymagających etapów całej inwestycji, wiążący się ze ścisłą współpracą zespołów projektowych, wykonawców i operatora sieci"" – powiedział, cytowany w komunikacie prasowym, Maciej Stryjecki, prezes Baltic Power. Farma na Bałtyku jest jednym z dwóch pierwszych projektów na świecie wykorzystujących turbiny o mocy 15 MW produkowane przez Vestas. Inwestycja zlokalizowana jest około 23 km od wybrzeża, na wysokości Choczewa i Łeby. Po zakończeniu budowy farma osiągnie moc około 1,2 GW i będzie produkować do 4 TWh energii elektrycznej rocznie. (PAP Biznes) pel/ asa/","https://www.bankier.pl/wiadomosc/Baltic-Power-w-koncowej-fazie-realizacji-zainstalowano-50-z-76-turbin-9155375.html"
"2026-06-22","Bankier","Sukcesja znów ciąży Cyfrowemu Polsatowi. Flauta na GPW w ostatnim tygodniu przed wakacjami","Poniedziałkowa sesja na warszawskim parkiecie upłynęła w mieszanych nastrojach. Wzrostowe otwarcie przerodziło się szybko w spadki, które okresowo kontrować starał się popyt. Brak obranego kierunku kojarzyć się może z wakacyjną flautą, co sugerować mogą także nieco niższe niż zwykle obroty. Taki obraz rynku współgrał ze sprzecznymi sygnałami płynącymi z Bliskiego Wschodu oraz wysypem krajowych niejednoznacznych danych makroekonomicznych. Ostatecznie WIG20 spadł o 0,53 proc., a szeroki rynek reprezentowany przez indeks WIG również zniżkował o 0,56 proc. Nieco większą przecenę zaliczyły średnie spółki, przez co mWIG40 poszedł w dół o 0,84 proc., a z kolei małe podmioty ucierpiały najmniej – sWIG80 stracił zaledwie 0,11 proc. Obniżone tempo handlu zdradzały także obroty, które na szerokim rynku nie przekroczyły nawet 2 mld zł (1,99 mld zł). Z kolei na WIG20 handel podliczono na niespełna 1,59 mld zł. W tym samym czasie na rynkach zagranicznych nastroje także były zróżnicowane. W momencie zamknięcia handlu w Warszawie niemiecki DAX zyskiwał 0,3 proc., francuski CAC40 spadał o 0,2 proc. a brytyjski FTSE100 zyskiwał 0,6 proc. Z kolei za oceanem Wall Street rozpoczęła poniedziałek od wzrostów, które z czasem przerodziły się spadki. O godz. 17.00 S&P500 tracił 0,4 proc. ale Nasdaq zniżkował już o przeszło 1 proc. Najwięcej na rynkach znów mówiło się o doniesieniach dotyczących rozmów dyplomatycznych USA z Iranem. Choć mediatorzy z Kataru i Pakistanu informowali o konstruktywnej atmosferze pokojowej, niepewność podsyciła decyzja Teheranu o ponownym zamknięciu cieśniny Ormuz, będąca reakcją na izraelskie bombardowania Libanu. Oliwy do ognia dolał prezydent Donald Trump, grożąc Iranowi atakiem w przypadku dalszych akcji Hezbollahu. Wcześniej wiceprezydent USA JD Vance, informował po rozmowach w szwajcarskim Bürgenstock, że Iran zgodził się na powrót inspektorów MAEA – co mogło zostać pozytywnie odebrane przez inwestorów. Na rodzimym podwórku inwestorzy zostali zasypani twardymi danymi. Po piątkowej produkcji przemysłowej, w poniedziałek poznaliśmy wskaźniki dotyczące handlu detalicznego , budownictwa oraz rynku pracy . Odczyty te nie miały jednak większego wpływu na ostateczny przebieg sesji na GPW. W gronie blue chipów liderem wzrostów w drugiej części dnia został CD Projekt, którego akcje podrożały o 2,41 proc. Powody do zadowolenia dało akcjonariuszom także Pepco, rosnące o 1,61 proc. Z pozytywnej strony pokazał się Orlen (0,9 proc.) – koncern podał, że flagowy projekt morskiej farmy wiatrowej Baltic Power wszedł w końcową fazę, a na morzu stoi już 50 z 76 turbin. Ponad kreską dzień zamknęły również KGHM (0,7 proc.) oraz spółki energetyczne: PGE (0,63 proc.) i Tauron (09,04 proc.). Po drugiej stronie barykady znalazły się Kęty, tracące 4,04 proc. Ponad 2-procentową przecenę zaliczyło Allegro (-2,22 proc.), którego akcje jednak w ostatnie dwa tygodnie podrożały o przeszło 15 proc. Słabością w WIG20 raziły banki z mBankiem (-01,67 proc.), Pekao (-1,66 proc.) i Aliorem (-1,22 proc.) na czele. W indeksie mWIG40 działo się bardzo dużo. Uwagę zwracał cyber_Folks, którego kurs wystrzelił o ok. 4 proc., ale sesję skończył wynikiem 2,33 proc. na plusie. O mocne 3,7 proc. podrożały także papiery JS, a o 3,44 proc. Synektika. Natomiast słabością raził Cyfrowy Polsat, tracąc aż 4,74 proc. To bezpośrednia reakcja na opublikowany list Zygmunta Solorza do akcjonariuszy przez poniedziałkowym WZA. Na Bankier.pl jako pierwsi przedstawiliśmy jego szczegóły . Solorz pisze w nim, że firma jest dziełem jego życia i zapowiada, walkę o nią przed skutkami narastającego konfliktu o kontrolę nad biznesem. Słabą sesję zanotował także Mirbud (-2,76 proc.). Spółka ucierpiała po informacji, że warszawski oddział GDDKiA unieważnił wybór oferty konsorcjum Mirbudu na projekt i budowę odcinka autostrady A2 od węzła ""Biała Podlaska"" do granicy państwa. Wśród maluchów z sWIG80 formą imponowała Mennica (5,97 proc.), mocno zyskiwały też Bogdanka (4,71 proc.) oraz Digital Network (3,45 proc.). Czerwoną latarnią rynku małych spółek pozostał Creotech Quantum, którego akcje zostały przecenione o 8,06 proc.","https://www.bankier.pl/wiadomosc/Sukcesja-znow-ciazy-Cyfrowemu-Polsatowi-Flauta-na-GPW-w-ostatnim-tygodniu-przed-wakacjami-9155710.html"
"2026-06-21","PAP","Ekstraklasa koszykarzy. Legia obroniła tytuł mistrza Polski","Koszykarze Legii Warszawa obronili tytuł mistrza Polski. W siódmym meczu finału play off pokonali u siebie Orlen Zastal Zielona Góra 78:70 i wygrali rywalizację 4-3. Po swój dziewiąty złoty medal w historii sięgnęli w roku 110-lecia klubu. Po raz pierwszy od 2019 roku mistrz pozostał na tronie na kolejny sezon. Wcześniej legioniści zdobywali tytuły w 1956, 1957, 1960, 1961, 1963, 1966, 1969 i 2025 roku. Legia Warszawa - Orlen Zastal Zielona Góra 78:70 (17:19, 29:19, 20:23, 12:9) Stan rywalizacji play off (do czterech zwycięstw): 4-3 dla Legii. Punkty: Legia Warszawa: Andrzej Pluta 15, Dominic Brewton 11, Race Thompson 11, Shane Hunter 10, Jayvon Graves 9, Michał Kolenda 8, Maksymilian Wilczek 7, Ojars Silins 5, Carl Ponsar 2. Orlen Zastal Zielona Góra: Andrzej Mazurczak 10, Jayvon Maughmer 10, Chavaughn Lewis 10, Conley Garrison 8, Jakub Szumert 8, Filip Matczak 8, Dwight Allen Wilson 6, Krzysztof Sulima 5, Patrick Cartier 5, Phil Fayne 0. (PAP) cegl/ sab/ know/","https://www.pap.pl/aktualnosci/ekstraklasa-koszykarzy-legia-obronila-tytul-mistrza-polski"
"2026-06-20","Bankier","Hurtowe zmiany w Orlenie. Benzyna w górę, diesel w dół, ale stacje i tak obniżają ceny","Orlen podniósł w sobotę ceny benzyny Eurosuper 95 o 42 zł, a benzyny Super Plus 98 o 74 zł i jednocześnie obniżył hurtową cenę oleju napędowego Ekodiesel o 9 zł za metr sześc. - wynika z danych opublikowanych przez koncern. Poprzednio, w piątek, w hurcie Orlenu wszystkie te paliwa staniały. Według hurtowego cennika koncernu w sobotę benzyna bezołowiowa Eurosuper 95 kosztuje tam 5 tys. 238 zł za metr sześc., czyli o 42 zł więcej niż dzień wcześniej, benzyna bezołowiowa Super Plus 98 kosztuje 5 tys. 890 zł za metr sześc., czyli o 74 zł więcej niż dzień wcześniej, natomiast olej napędowy Ekodiesel kosztuje 5 tys. 356 zł za metr sześc., czyli o 9 zł mniej niż dzień wcześniej. Poprzednio, w piątek, Orlen obniżył hurtowe ceny paliw, w tym benzyny Eurosuper 95 o 61 zł, do 5 tys. 196 zł za metr sześc., benzyny Super Plus 98 o 52 zł, do 5 tys. 816 zł za metr sześc., a oleju napędowego Ekodiesel o 74 zł, do 5 tys. 365 zł za metr sześc. Od 31 marca na wszystkich stacjach w Polsce obowiązują ceny maksymalne paliw, wprowadzone czasowo w ramach rządowego pakietu regulacji „Ceny Paliwa Niżej”, który ma ograniczać wzrost cen tych produktów. Ustalane są na podstawie średniej ceny hurtowej paliw na rynku krajowym, powiększonej o akcyzę, opłatę paliwową, a także marżę sprzedażową i podatek VAT. Z ostatniego obwieszczenia ministra energii o cenach maksymalnych paliw wynika, że od soboty do poniedziałku włącznie na stacjach litr benzyny bezołowiowej 95 będzie kosztował nie więcej niż 5,94 zł, benzyny bezołowiowej 98 - 6,61 zł, a oleju napędowego - 6,12 zł. Jest to spadek cen wszystkich tych paliw w porównaniu z piątkiem, gdy litr benzyny 95 kosztował maksymalnie 6 zł, benzyny 98 - 6,66 zł, natomiast oleju napędowego - 6,20 zł. Ceny maksymalne paliw ogłaszane są w codziennym obwieszczeniu, a obowiązują one od dnia następnego po publikacji w Monitorze Polskim. W przypadku ogłoszenia przed dniami wolnymi od pracy i świętami obowiązują do najbliższego dnia roboczego włącznie. Pierwszego dnia obowiązywania cen maksymalnych paliw na stacjach, czyli 31 marca, benzyna bezołowiowa 95 kosztowała nie więcej niż 6,16 zł za litr, benzyna bezołowiowa 98 - 6,76 zł, a olej napędowy - 7,60 zł. W poniedziałek Ministerstwo Finansów podało, że ze względu na zmieniającą się sytuację na Bliskim Wschodzie zdecydowano o stopniowym ograniczaniu programu „Ceny Paliwa Niżej”. Obniżka VAT będzie obowiązywała do 30 czerwca, z kolei dotychczasowa obniżka akcyzy przestała obowiązywać we wtorek, 16 czerwca. Atak USA i Izraela na Iran 28 lutego spowodował wzrost notowań ropy naftowej na świecie, a także notowań paliw gotowych, co przełożyło się na ceny detaliczne tych produktów na stacjach, również w Polsce. Jak podkreśliło biuro Reflex w piątkowej analizie, w tym tygodniu ruchy cen paliw na stacjach były determinowane nie tylko sytuacją na rynku ropy naftowej, ale też przez częściowe wygaszenie programu „Ceny Paliwa Niżej”, od 16 czerwca. Analitycy zwrócili jednocześnie uwagę, że konsekwencje powrotu akcyzy do poziomu sprzed wprowadzenia tego pakietu regulacji były mniej odczuwalne ze względu na spadek cen ropy i paliw na rynku ARA (Amsterdam, Rotterdam, Antwerpia - PAP), przy czym w większym stopniu dotyczyły jednak benzyny niż oleju napędowego. Biuro Reflex wskazało także, że porównanie maksymalnych cen paliw ogłoszonych na obecny weekend i najbliższy poniedziałek z poziomami obowiązującymi od 13 do 15 czerwca „pokazuje, że powrót do wyższej akcyzy został już w pełni skompensowany przez spadek notowań paliw na rynku ARA”. Jednocześnie analitycy wspomnieli, że w skali tygodnia, od 12 do 18 czerwca, ropa Brent na giełdzie ICE potaniała o 7,48 dol. na baryłce. Spadki cen sierpniowej serii kontraktów na ten gatunek surowca wyhamowały w rejonie 76,50 dol. za baryłkę i rynek rozpoczął korektę. W piątek, 19 czerwca, rano baryłka ropy Brent kosztowała niecałe 80 dol. i była o około 8 dol. droższa niż przed wybuchem wojny na Bliskim Wschodzie. (PAP) mb/ miś/","https://www.bankier.pl/wiadomosc/Hurtowe-zmiany-w-Orlenie-Benzyna-w-gore-diesel-w-dol-ale-stacje-i-tak-obnizaja-ceny-9154886.html"
"2026-06-19","Bankier","Podatek od nadzwyczajnych zysków uchwalony. Orlen i importerzy zapłacą za rynkową stabilizację cen","Sejm uchwalił w piątek ustawę, która zakłada, że firmy paliwowe zapłacą podatek, tzw. windfall tax, od nadzwyczajnych zysków. Szacowane na 4 mld zł wpływy z tego podatku mają posłużyć sfinansowaniu pakietu CPN (Ceny Paliwa Niżej). Za uchwaleniem ustawy o podatku od nadzwyczajnych zysków firm ze zbycia paliw ciekłych osiągniętych w okresie od marca do grudnia 2026 r. głosowało 231 posłów, 201 było przeciw, a jeden wstrzymał się od głosu. Teraz ustawa trafi do Senatu. Rozwiązania przewidziane ustawą to reakcja rządu na gwałtowny wzrost marż w sektorze paliwowym począwszy od marca 2026 r. Nowa danina, znana jako windfall tax, ma obciążyć producentów i importerów paliw, którzy osiągnęli ponadprzeciętne dochody w wyniku destabilizacji rynków energii po wybuchu konfliktu na Bliskim Wschodzie. Stawka podatku ma wynosić 60 proc., a podstawę opodatkowania stanowić będzie nadwyżka przychodów ponad kwotę przychodów, jaka zostałaby osiągnięta przez tego podatnika przy zastosowaniu marży referencyjnej. Rokiem referencyjnym będzie rok obrotowy zakończony przed 1 marca 2026 r. Marża referencyjna to średnia marża sprzedaży paliw ciekłych w 2025 r. powiększona o 20 proc. Wpływy z nowej daniny mają zrekompensować stratę dochodów (szacowaną na ok. 4,8 mld zł w ciągu pierwszych trzech miesięcy), która powstała w wyniku obniżenia stawki podatku VAT na paliwa do 8 proc. oraz redukcji akcyzy do minimalnych poziomów unijnych. Projekt zakłada, że producenci i sprzedawcy paliw ciekłych zapłacą łącznie 4 mld zł podatku od nadzwyczajnych zysków osiągniętych w okresie podwyższonych cen paliw z czego 3,8 mld zł w tym roku, a resztę - w 2027 r. Podatnikami od nadzwyczajnych zysków mają być podmioty prowadzące w Polsce działalność w zakresie wytwarzania paliw ciekłych, obrotu paliwami ciekłymi z zagranicą, które importują lub kupują je w ramach wewnątrzwspólnotowego nabycia. Projekt obejmuje swoim zakresem zarówno duże koncerny, jak i mikro-, małych i średnich przedsiębiorców. Według szacunków, krąg podatników obejmie około 20–30 podmiotów. Opodatkowaniu podlegać będą przychody ze zbycia paliw ciekłych w rozumieniu przepisów o monitorowaniu jakości paliw. W praktyce są to przede wszystkim benzyny silnikowe, oleje napędowe. Z nowej regulacji wyłączone mają być oleje opałowe, czy procesy mieszania paliw, a także obywatele i gospodarstwa domowe. Z oceny skutków regulacji wynika, że udział Orlenu, który jest największym podmiotem na rynku paliwowym i petrochemicznym w Polsce, w podstawie opodatkowania wyniesie 60 proc., a udział pozostałych podmiotów z tego rynku - 40 proc. Podatki od nadzwyczajnych zysków (tzw. windfall tax) firm energetycznych, paliwowych i banków funkcjonowały i nadal funkcjonują w różnych krajach europejskich. Wprowadzały je m.in. Czechy, Słowacja, Hiszpania, Portugalia, Włochy czy Wielka Brytania. We Francji trwa debata o objęciu nim m.in. strategicznego koncernu TotalEnergies, ale rząd podchodzi do tego pomysłu ostrożnie. We Francji o takim podatku mówił w maju minister finansów Roland Lescure. Rząd może rozważyć takie rozwiązanie, ale dyskusja na temat dodatkowych podatków odbędzie się jesienią. Opozycja apelowała w związku ze wzrostem cen paliw o nałożenie podatków np. na firmę TotalEnergies. Koncern w pierwszym kwartale br. odnotował rekordowy zysk w wysokości 4,96 mld euro. Politycy wypowiadali się jednak ostrożnie na temat takiej możliwości. Rzeczniczka rządu Maud Bregeon przekonywała, że „łatwo jest krytykować Total”, natomiast istnienie koncernu jest kluczowe dla suwerenności energetycznej kraju. Sam koncern argumentował, że podatki, które ogółem zapłacił w minionym roku (także poza Francją), sięgnęły 19 mld euro. We Włoszech w 2023 r. parlament zatwierdził z poprawkami windfall tax, czyli podatek od nadzwyczajnych zysków banków, obejmujący zarówno krajowe banki, jak i włoskie oddziały banków zagranicznych. Wszedł on w życie w październiku 2023 r. Rząd Giorgii Meloni ogłosił wówczas, że jednorazowy podatek od nadmiernych zysków banków wynosić będzie 40 proc. Centroprawicowy gabinet argumentował, że banki zarabiają ogromne kwoty na rosnących stopach procentowych w czasie, gdy obywatele zmagają się z inflacją. Po krytyce rząd złagodził podatek, co pozwoliło bankom znacząco obniżyć należność, m.in. poprzez zwiększenie kapitałów własnych zamiast płacenia podatku. W rezultacie planowane z tego tytułu wpływy do budżetu były niższe, niż zakładano. (PAP)","https://www.bankier.pl/wiadomosc/Podatek-od-nadzwyczajnych-zyskow-uchwalony-Orlen-i-importerzy-zaplaca-za-rynkowa-stabilizacje-cen-9154210.html"
"2026-06-19","Bankier","Sejm uchwalił ustawę o podatku od nadzwyczajnych zysków firm paliwowych","Sejm uchwalił w piątek ustawę, która zakłada, że firmy paliwowe zapłacą podatek, tzw. windfall tax, od nadzwyczajnych zysków. Szacowane na 4 mld zł wpływy z tego podatku mają posłużyć sfinansowaniu pakietu CPN (Ceny Paliwa Niżej). Za uchwaleniem ustawy o podatku od nadzwyczajnych zysków firm ze zbycia paliw ciekłych osiągniętych w okresie od marca do grudnia 2026 r. głosowało 231 posłów, 201 było przeciw, a jeden wstrzymał się od głosu. Teraz ustawa trafi do Senatu. Rozwiązania przewidziane ustawą to reakcja rządu na gwałtowny wzrost marż w sektorze paliwowym począwszy od marca 2026 r. Nowa danina, znana jako windfall tax, ma obciążyć producentów i importerów paliw, którzy osiągnęli ponadprzeciętne dochody w wyniku destabilizacji rynków energii po wybuchu konfliktu na Bliskim Wschodzie. Stawka podatku ma wynosić 60 proc., a podstawę opodatkowania stanowić będzie nadwyżka przychodów ponad kwotę przychodów, jaka zostałaby osiągnięta przez tego podatnika przy zastosowaniu marży referencyjnej. Rokiem referencyjnym będzie rok obrotowy zakończony przed 1 marca 2026 r. Marża referencyjna to średnia marża sprzedaży paliw ciekłych w 2025 r. powiększona o 20 proc. Wpływy z nowej daniny mają zrekompensować stratę dochodów (szacowaną na ok. 4,8 mld zł w ciągu pierwszych trzech miesięcy), która powstała w wyniku obniżenia stawki podatku VAT na paliwa do 8 proc. oraz redukcji akcyzy do minimalnych poziomów unijnych. Projekt zakłada, że producenci i sprzedawcy paliw ciekłych zapłacą łącznie 4 mld zł podatku od nadzwyczajnych zysków osiągniętych w okresie podwyższonych cen paliw z czego 3,8 mld zł w tym roku, a resztę - w 2027 r. Podatnikami od nadzwyczajnych zysków mają być podmioty prowadzące w Polsce działalność w zakresie wytwarzania paliw ciekłych, obrotu paliwami ciekłymi z zagranicą, które importują lub kupują je w ramach wewnątrzwspólnotowego nabycia. Projekt obejmuje swoim zakresem zarówno duże koncerny, jak i mikro-, małych i średnich przedsiębiorców. Według szacunków, krąg podatników obejmie około 20–30 podmiotów. Opodatkowaniu podlegać będą przychody ze zbycia paliw ciekłych w rozumieniu przepisów o monitorowaniu jakości paliw. W praktyce są to przede wszystkim benzyny silnikowe, oleje napędowe. Z nowej regulacji wyłączone mają być oleje opałowe, czy procesy mieszania paliw, a także obywatele i gospodarstwa domowe. Z oceny skutków regulacji wynika, że udział Orlenu, który jest największym podmiotem na rynku paliwowym i petrochemicznym w Polsce, w podstawie opodatkowania wyniesie 60 proc., a udział pozostałych podmiotów z tego rynku - 40 proc. (PAP) kawa/ jls/ mrr/ ana/","https://www.bankier.pl/wiadomosc/Sejm-uchwalil-ustawe-o-podatku-od-nadzwyczajnych-zyskow-firm-paliwowych-9154213.html"
"2026-06-19","Bankier","Wraca wysoki VAT na paliwa. Jak rozegrać czerwcowe tankowania?","Wiemy już, że wraz z końcem czerwca wygasną obniżone stawki VAT na benzynę i olej napędowy. Ale wszystko może zostać rozegrane tak, abyśmy tego nie zauważyli. Czy zatem będzie się opłacało zatankować pod korek i zalać kanistry ostatniego dnia czerwca? Od poniedziałku znów obowiązują „przedwojenne” stawki akcyzy na benzyny i olej napędowy . Oznaczało to automatycznie wyższe ceny paliw o ok. 30 groszy na litrze , gdyż akcyza jest ukryta w cenie hurtowej, od której potem jako konsumenci płacimy VAT. Równocześnie wzrost cen hurtowych był mitygowany przez spadki giełdowych notowań paliw płynnych. Teraz już wiemy, że „pakiet CPN” przestanie obowiązywać wraz z końcem czerwca . Oznacza to, że od 1 lipca stawka VAT na benzyny i olej napędowy wzrośnie z 8% do 23%. Jednocześnie nie musi to oznaczać, że paliwa z dnia na dzień podrożeją o kilkanaście procent . A to dlatego, że na rynkach światowych w ostatnich dniach odnotowano spadek cen benzyny i (zwłaszcza) oleju napędowego. Z tego też powodu teoretycznie  można oczekiwać dalszego spadku cen hurtowych. Pakiet CPN wszedł życie pod koniec marca. Miał na celu nierynkowe obniżenie cen benzyn i oleju napędowego, ale tylko dla konsumentów (tj. osób fizycznych).  Chodziło o złagodzenie społecznych i ekonomicznych skutków ataku USA i Izraela na Iran 28 lutego, który wywołał irańską blokadę Cieśniny Ormuz i największy od blisko pół wieku kryzys naftowy, manifestujący się ograniczeniem dostaw ropy naftowej oraz skokowym wzrostem jej notowań. Na razie wiemy tyle, że w trzecim tygodniu czerwca cena benzyny bezołowiowej 95 wynosiła średnio 6,00 zł/l i była aż o 12 gr/l wyższa niż przed tygodniem – wynika z danych BM Reflex. Widać tu zatem wpływ poniedziałkowej podwyżki stawek akcyzy. Z kolei olej napędowy kosztował przeciętnie 6,30 zł/l i był o 4 grosze na litrze tańszy niż tydzień wcześniej. Średnia detaliczna cena autogazu obniżyła się o kolejne 6 gr/l i wyniosła 3,45 zł/l. Był to najniższy odczyt od trzech miesięcy. Równocześnie od czasu ogłoszenia wstępnego porozumienia pokojowego pomiędzy USA a Iranem na światowych rynkach paliwowych mamy do czynienia ze znaczącą przeceną. W piątek w południe tona oleju napędowego na londyńskiej giełdzie ICE kosztowała 888 USD, podczas gdy jeszcze na początku czerwca było to o 200 USD/t więcej. W ten sposób giełdowe notowania „diesla” powróciły do poziomów z początku marca. Ale jeszcze nie do wartości sprzed amerykańsko-izraelskiej agresji, gdy tona ON kosztowała ok. 750 USD. Z kolei przez ostatni miesiąc kurs ropy Brent obniżył się z przeszło 105 USD do niespełna 80 USD za baryłkę. Pod koniec tygodnia „czarne złoto” było najtańsze od przeszło trzech miesięcy, ale wciąż wyraźnie droższe niż na początku 2026 roku. Warto przy tym odnotować, że analogicznego spadku nie widzimy w przypadku benzyny, która na nowojorskiej giełdzie towarowej była wyceniana na 2,98 USD za galon. Tutaj największy spadek miał miejsce miesiąc temu, gdy paliwo to potaniało z 3,70 USD do 3,00 USD/galon. Od tego czasu obserwujemy stabilizację w pobliżu poziomu 3,00 USD. Na to wszystko trzeba jeszcze nałożyć umocnienie dolara amerykańskiego , co podbija ceny paliw wyrażone w polskim złotym. Trzeba też brać poprawkę na fakt, że w reżymie prawnym CPN to w praktyce polityka cenowa Orlenu określa, jaką cenę widzimy przy dystrybutorze. Cena maksymalna jest ustalana jako cena hurtowa powiększona o stawkę VAT i urzędową 30-groszową marżę detaliczną. Kluczowe znaczenie ma zatem to, co w swoim cenniku wpisze kierownictwo płockiej rafinerii. W piątek 19 czerwca Orlen oferował benzynę Eurosuper 95 po 5 196 zł/m3, co po doliczeniu 8% VAT-u (akcyza i inne parapodatki są już wliczone w cenę hurtową) implikowałoby cenę rzędu 5,61 zł/l. To o 10 gr/l mniej niż przed tygodniem. Teoretycznie gdyby stawka w hurcie pozostała bez zmian do końca czerwca, to po przywróceniu 23% VAT od lipca tankowalibyśmy po ok. 6,40 zł/l.  Z kolei olej napędowy Ekodiesel w piątkowym cenniku płockiej rafinerii kosztował 5 365 zł/m3, co po ovatowaniu dawałoby 5,79 zł/l. Ale przy 23-procentowym vacie byłoby to już 6,60 zł/l. Warto też przyglądać się polityce cenowej płockiego koncernu w najbliższych tygodniach. Istnieje bowiem możliwość, że Orlen powtórzy „myk” z grudnia 2022 roku. Przez kilka tygodni Orlen sztucznie zawyżał wtedy ceny hurtowe , aby ukryć przed opinią publiczną noworoczny wzrost stawki VAT z 8% do 23%. 31 grudnia 2022 roku Orlen obniżył ceny hurtowe benzyny i oleju napędowego dokładnie o tyle, o ile 1 stycznia 2023 roku wzrósł VAT na paliwa . Jest ryzyko, że teraz ktoś postanowi powtórzyć ten scenariusz. Jeżeli jednak ceny będą się kształtować w sposób rynkowy, to przy utrzymaniu obecnych trendów na rynkach światowych końcówka czerwca może przynieść okazję na tańsze zatankowanie auta i ewentualnie odnotowanie domowych rezerw strategicznych benzyny czy oleju napędowego.","https://www.bankier.pl/wiadomosc/Wraca-wysoki-VAT-na-paliwa-Jak-rozegrac-czerwcowe-tankowania-9154374.html"
