"data","zrodlo","tytul","tresc","link"
"2026-03-18","PAP","Lekkoatletyczne HMŚ w Toruniu. Spore nadzieje biało-czerwonych w roli gospodarzy","Płotkarze Pia Skrzyszowska i Jakub Szymański, skacząca wzwyż Maria Żodzik i Natalia Bukowiecka w biegu na 400 m to największe polskie nadzieje medalowe w halowych mistrzostwach świata w Toruniu, które rozpoczną się w piątek. Gospodarzy będzie reprezentować będzie 32 lekkoatletów. W składzie biało-czerwonych znalazło 17 zawodniczek i 15 zawodników. - Mamy kilka szans medalowych, impreza sezonu u siebie sprzyja uzyskaniu cennych wyników – powiedział prezes Polskiego Związku Lekkiej Atletyki Sebastian Chmara. Polska poprzednio HMŚ gościła w 2014 roku. Wówczas najlepsi lekkoatleci świata rywalizowali w Sopocie. Polacy wywalczyli wtedy trzy medale. Mistrzynią świata została w skoku wzwyż Kamila Lićwinko, a srebrne medale zdobyli w biegu na 800 m Adam Kszczot i Angelika Cichocka. Liderami kadry w tym sezonie są biegający przez płotki Szymański i Skrzyszowska, skacząca wzwyż Żodzik, która jesienią została wicemistrzynią globu na stadionie, specjalistka od dystansu 400 m Bukowiecka, a także sprinterka Ewa Swoboda. Szymański jest ex aequo liderem listy zgłoszeń w biegu na 60 m ppł z rekordem kraju z tego sezonu 7,37. W rozmowie z PAP po wygraniu mistrzostw Polski wprost wskazywał, że chce walczyć o złoto. - Jest dwóch Amerykanów i jestem ja. Będziemy się bić o miejsca na podium mistrzostw świata w Toruniu. W finale będzie ostateczna rozgrywka. Zobaczymy, kto wytrzyma - powiedział PAP Szymański. Ocenił, że jednym z jego atutów może być świetna znajomość toruńskiej bieżni i atmosfery panującej w hali. - Kibice podczas Orlen Copernicus Cup i podczas mistrzostw Polski przypomnieli mi jak tu jest. Będę gospodarzem HMŚ. „Pojedziemy” z nimi - buńczucznie zapowiedział Szymański. Duże szanse będą mieć polskie sztafety 4x400 m, szczególnie mieszana i kobieca. O niespodziankę może się postarać Klaudia Kazimierska w biegu na 1500 m i skoczkini w dal Anna Matuszewicz. Pierwsza na co dzień trenuje za oceanem i w tym roku poprawiła już halowe rekordy kraju Lidii Chojeckiej na dystansach 1500 m i jednej mili. Druga będzie u siebie w domu, bo reprezentuje MKL Toruń. W tym roku Matuszewicz wynikiem 6,77 poprawiła rekord Polski, który był niezmienny od 46 lat. Walkę o podium deklarują także pięcioboistki Paulina Ligarska i Adrianna Sułek-Schubert. Sześcioro reprezentantów Polski znajduje się w Top 3 zgłoszeń do imprezy w Toruniu. Płotkarz Szymański ma ex aequo najlepszy wynik z zawodników, którzy wystartują w Polsce, a Skrzyszowska, Ligarska i skaczący wzwyż Mateusz Kołodziejski - drugi. Trzecimi rezultatami w tym sezonie wśród przymierzających się do startu w HMŚ legitymują się Żodzik i Bukowiecka. - Mamy w tym roku większe nadzieje, bo mamy zawodników w czołówkach list światowych w poszczególnych konkurencjach. Wiadomo, że listy nie biegają czy nie skaczą i trzeba się dobrze zaprezentować na imprezie docelowej, ale to, że startujemy przed własną publicznością i dobrze znamy halę w Toruniu da nam pewną przewagę i zdobędziemy więcej niż jeden medal - powiedziała rekordzistka Polski w biegu na 400 m w Studiu PAP. - Dla mnie medal u siebie byłbym czymś niesamowitym - dodała Bukowiecka. Były prezes PZLA Jerzy Skucha powiedział PAP, że jego zdaniem szanse medalowe mają Szymański, wieloboistki, Żodzik, Maciej Wyderka na 800 m, Bukowiecka i polski mikst, jeżeli wystartuje w najsilniejszym składzie. - Stawiam na trzy medale Polaków - ocenił doświadczony działacz. Edycja numer 21 halowe mistrzostwa świata w Kujawsko-Pomorskiej Arenie Toruń rozpocznie się w piątek, a zakończy w niedzielę. <PRE> Skład reprezentacji Polski na halowe MŚ w lekkoatletyce w Toruniu: - kobiety 60 m Magdalena Stefanowicz (AZS AWF Katowice) Ewa Swoboda (Podlasie Białystok) 400 m, sztafety 4x400 m Natalia Bukowiecka (Podlasie Białystok) Justyna Święty-Ersetic (AZS AWF Katowice 800 m Julia Jaguścik (AZS AWF Warszawa) Anna Wielgosz (CWKS Resovia Rzeszów) 1500 m Klaudia Kazimierska (LKS Vectra Włocławek) 60 m ppł Pia Skrzyszowska (AZS AWF Warszawa) wzwyż Maria Żodzik (Podlasie Białystok) w dal Anna Matuszewicz (MKL Toruń) pięciobój Paulina Ligarska (SKLA Sopot) Adrianna Sułek-Schubert (Brda Bydgoszcz) 4x400 m Weronika Bartnowska (AZS AWF Warszawa) Anna Maria Gryc (AZS AWF Warszawa) Anastazja Kuś (AZS UWM Olsztyn) Marika Popowicz-Drapała (CWZS Zawisza Bydgoszcz SL) Klaudia Osipiuk (AZS AWF Biała-Podlaska) - mężczyźni 60 m Dominik Kopeć (Agros Zamość) Oliwer Wdowik (CWKS Resovia Rzeszów) 800 m Filip Ostrowski (KKL Radło Kwidzyn Maciej Wyderka (AZS AWF Katowice) 1500 m Kamil Herzyk (SLiS JUST TEAM Bielsko-Biała) 60 m ppł Damian Czykier (Podlasie Białystok) Jakub Szymański (SKLA Sopot) wzwyż Mateusz Kołodziejski (CWZS Zawisza Bydgoszcz SL) kula Konrad Bukowiecki (AZS UWM Olsztyn) sztafety 4x400 m Kajetan Duszyński (AZS Łódź) Marcin Karolewski (OŚ AZS Poznań) Mikołaj Pyszka (OŚ AZS Poznań) Mateusz Rzeźniczak (MKS Aleksandrów Łódzki) Wiktor Wróbel (AZS Łódź) Remigiusz Zazula (AZS UMCS Lublin) </PRE> Autor: Tomasz Więcławski (PAP) twi/ pp/ kgr/","https://www.pap.pl/aktualnosci/lekkoatletyczne-hms-w-toruniu-spore-nadzieje-bialo-czerwonych-w-roli-gospodarzy"
"2026-03-17","Bankier","Litwa walczy z cenami paliw. Orlen musi uwolnić zapasy ropy","Spółka Orlen Lietuva zadeklarowała w komentarzu przekazanym agencji BNS gotowość do uwolnienia części swoich rezerw paliw na rynek. Przyznała, że może to przyczynić się do obniżenia cen, ale nie będzie czynnikiem decydującym. Uwolnienie rezerw może przyczynić się do spadku cen poprzez zwiększenie podaży, jednak kluczowe znaczenie ma sytuacja na rynku globalnym. Decyzje poszczególnych państw dotyczące rezerw są tylko jednym z czynników wpływających na ceny – zaznaczył Orlen Lietuva. Harmonogram uwalniania rezerw był omawiany we wtorek na spotkaniu w litewskim ministerstwie energetyki z udziałem Orlen Lietuva oraz innych uczestników rynku. Wiceminister energetyki Gabriel Gorbaczewski podkreślił w komunikacie resortu, że u . Dodał, że „odbudowa wykorzystanych rezerw nastąpi w późniejszym okresie, gdy sytuacja rynkowa się ustabilizuje, a koszty tego procesu nie zostaną przeniesione na konsumentów”. Litwa dysponuje rezerwami ropy i produktów naftowych na poziomie około 650 tys. ton. Około dwóch trzecich tych zapasów jest kontrolowanych przez przedsiębiorstwa, z czego największą część posiada Orlen Lietuva. Pozostałe rezerwy należą do skarbu państwa. Orlen Lietuva jest jednym z największych klientów KN Energies – operatora produktów energii płynnej i terminali LNG w Kłajpedzie. To strategiczna spółka na Litwie, obsługująca rafinerię ropy naftowej w Możejkach i terminal naftowy w Butyndze. Zatrudnia ponad 1,5 tys. osób. Z Wilna Aleksandra Akińczo (PAP) aki/ rtt/ drag/ gor/","https://www.bankier.pl/wiadomosc/Orlen-Lietuva-ma-niezwlocznie-wprowadzic-na-rynek-80-tys-ton-paliw-z-rezerw-9099733.html"
"2026-03-17","Bankier","Energetyczny wystrzał na giełdzie. Dwucyfrowe wzrosty największych, rekord Orlenu i świetna forma JSW","Indeks szerokiego rynku . Dobrze radziły sobie także główne indeksy na giełdzie w Pradze i Stambule. . Nieco skromniej, ale wciąż nad kreską, finiszował sWIG80 ze wzrostem o 0,83 proc. Obroty na szerokim rynku wyniosły 2,33 mld zł, z czego 1,91 mld zł dotyczył spółek z WIG20. Nastroje na światowych rynkach uległy wyraźnej poprawie dzięki doniesieniom zza oceanu. Głównym motorem napędowym stała się , który zasugerował, że – w ciągu tygodni, a nie miesięcy. W efekcie, mimo wzrostów cen ropy, które ostatnio oznaczały spadki na rynkach akcji, tym razem inwestorzy podnieśli europejskie indeksy do góry. Niemiecki DAX zyskiwał 0,8 proc., francuski CAC 40 rósł o 0,6 proc., a brytyjski FTSE 100 zyskiwał 0,8 proc. Za oceanem S&P 500 oraz Nasdaq notowały wzrosty po około 0,3 proc. – W centrum uwagi w tym tygodniu będzie środowe posiedzenie amerykańskiej Rezerwy Federalnej, przy czym ważniejsza od samej decyzji będzie konferencja Jerome’a Powella – wskazują analitycy. Niekwestionowanym . , osiągając w szczytowym momencie 136,38 zł. Sesję Orlen skończył z ceną akcji na poziomie 136,04 zł. Impulsem do wtorkowych zakupów mogły być i narracji szefowej KE Ursula Von der Leyen o możliwych zmianach na rynku uprawnień CO2 i gazu. Zapowiedzi : PGE wystrzeliło o 13,66 proc., Tauron z mWIG40 zyskał 10,5 proc. (dodatkowo wspierany solidnymi wynikami za 2025 r.), Enea urosła o 11,74 proc. ZEPAK zyskał 8,03 proc., Kogeneracja 5,06 proc. , stąd tak mocna postawa indeksu średnich firm. ""Zapowiedź KE oznacza więcej darmowych uprawnień CO2 dla przemysłu i wolniejszy proces wycofywania uprawnień z rynku. Zgodnie z naszymi przypuszczeniami, nie zapowiada się na radykalny zwrot w polityce klimatycznej, ani w ETS, tym bardziej w merit order. Przyjęcie pułapów cenowych na poziomie UE dla gazu jest wg. nas mało prawdopodobny. Jest natomiast możliwy na poziomie budżetów krajowych - wybór padnie prawdopodobnie na zgody na subsydia dla odbiorców na poziomie krajowym"" - napisał w komentarzu Michał Kozak, analityk DM Trigon. ""Ten scenariusz w naszej opinii może ograniczyć odbicie cen CO2 (słabość vs. ceny gazu i węgla), co może być pozytywne dla wyników PGE. Nie spodziewamy się żadnych decyzji ws. ograniczania zysków w dystrybucji - problem został naświetlonym poszczególnym rządom, jednak decyzje w tej sprawie powinny pozostać na poziomie poszczególnych gospodarek"" - dodał. Jego zdaniem, spadek notowań krajowych spółek energetycznych w ostatnich tygodniach był zbyt silny. ""Były obawy o dystrybucję, z powodu ryzyk w tym obszarze, ale uważamy, że polski sektor energetyczny przereagował, porównując do notowań spółek europejskich"" - powiedział Michał Kozak PAP Biznes. Zmienny przebieg miała sesja dla akcjonariuszy Budimeksu. i zakończył dzień na symbolicznym minusie (-0,52 proc.). Pod presją znalazło się , na co wpływ miały doniesienia o nowej funkcjonalności . Z kolei CD Projekt (-0,37 proc.) zanotował skromny spadek, podczas gdy gracze czekają na technologiczną aktualizację ""Cyberpunka 2077"" pod nową konsolę Sony PS5 Pro. Minimalnie pod kreską znalazło się także Dino (-0,1 proc.), a w kontekście spółki , które na Bankier.pl śledzi Katarzyna Wiązowska. , że długo oczekiwane mediacje pomiędzy zarządem Dino a związkami zawodowymi działającymi w sieci miały odbyć się 17 i 18 marca 2026 r. Okazało się jednak, że muszą zostać przesunięte. Na zapleczu giełdowej ekstraklasy również działo się sporo. Poza opisanymi spółkami energetycznymi w indeksie mWIG40 którego zysk netto za IV kwartał 2025 r. (596,4 mln zł) pobił oczekiwania analityków o blisko 8 proc. Z kolei , mimo pochwalenia się rekordową sprzedażą lokali. , co przy obecnym kursie daje blisko 5,8 proc. stopy dywidendy. Mocny był , o czym więcej w wywiadzie z branżowym analitykiem pt. . . Ma to być dokument strategiczny, który umożliwi wypłatę świadczeń osłonowych pracownikom Jastrzębskiej Spółki Węglowych. Wsparciem dla kursu są także pomysły rewizji systemu ETS, o czym więcej we wspomnianym wywiadzie. Redaktor działu Rynki Bankier.pl. Absolwent finansów i rachunkowości na UMCS w Lublinie. W czasie studiów zainteresował się giełdą i rynkami finansowymi, które to zainteresowania rozwinął na SGH w Warszawie na kierunku Bankowość Inwestycyjna. Na co dzień obserwuje notowania warszawskiej giełdy, by przekazać czytelnikom portalu najważniejsze informacje z parkietu oraz przybliżyć istotne wiadomości ze spółek. Telefon 728 927 242","https://www.bankier.pl/wiadomosc/Energetyczny-wystrzal-na-gieldzie-Dwucyfrowe-wzrosty-najwiekszych-rekord-Orlenu-i-swietna-forma-JSW-9099766.html"
"2026-03-17","Bankier","POLIMEX-MOSTOSTAL: Zawiadomienie o zmianie udziału w ogólnej liczbie głosów.","Raport bieżący nr / 2026 Data sporządzenia: 2026-03-17 Skrócona nazwa emitenta POLIMEX-MOSTOSTAL Temat Zawiadomienie o zmianie udziału w ogólnej liczbie głosów. Podstawa prawna Art. 70 pkt 1 Ustawy o ofercie – nabycie lub zbycie znacznego pakietu akcji Treść raportu: Zarząd Polimex Mostostal S.A. z siedzibą w Warszawie („Spółka”) informuje, że w dniu 17 marca 2026 r. do Spółki wpłynęło zawiadomienie sporządzone w trybie art. 69 Ustawy z dnia 29 lipca 2005 r. o ofercie publicznej i warunkach wprowadzania instrumentów finansowych do zorganizowanego systemu obrotu oraz o spółkach publicznych, pochodzące od działających w porozumieniu akcjonariuszy: ENEA S.A. z siedzibą w Poznaniu, ENERGA S.A. z siedzibą w Gdańsku, PGE Polska Grupa Energetyczna S.A. z siedzibą w Lublinie, Orlen Technologie S.A. z siedzibą w Krośnie, dotyczące zmiany udziału w ogólnej liczbie głosów na walnym zgromadzeniu Spółki. Treść przedmiotowego zawiadomienia przedstawiono w załączniku do niniejszego raportu. Załączniki Plik Opis Zawiadomienie na podstawie art. 69 ust. 1 lub 2 w zw. z art. 87 ust. 1 pkt 5 ustawy o ofercie POLIMEX-MOSTOSTAL SA (pełna nazwa emitenta) POLIMEX-MOSTOSTAL Budownictwo (bud) (skrócona nazwa emitenta) (sektor wg. klasyfikacji GPW w W-wie) 00-124 Warszawa (kod pocztowy) (miejscowość) Al. Jana Pawła II (ulica) (numer) 022 8297100 022 8260493 (telefon) (fax) kontakt@polimex.pl www.polimex.pl (e-mail) (www) 8210014509 710252031 (NIP) (REGON) Data Imię i Nazwisko Stanowisko/Funkcja Podpis 2026-03-17 Michał Głowiński Ekspert ds. prawnych","https://www.bankier.pl/wiadomosc/POLIMEX-MOSTOSTAL-Zawiadomienie-o-zmianie-udzialu-w-ogolnej-liczbie-glosow-9099795.html"
"2026-03-17","Bankier","555-tonowa kolumna przejedzie ulicami Płocka. To giganty z Chin dla Orlenu","Dwa zestawy połączonych barek z obiema konstrukcjami stalowymi przypłynęły Wisłą do Płocka w niedzielę, przekraczając po drodze tamę we Włocławku. Wcześniej, na początku marca tego roku, dotarły statkiem do portu w Gdańsku z Szanghaju w Chinach, skąd wyruszyły w rejs z początkiem grudnia. Transport z Gdańska do Płocka odbył się na dwóch zestawach barek. Za wszystkie operacje transportowe na całej trasie, w tym także za rozładunek obu kolumn z barek w Płocku, a potem za ich dostarczenie specjalną platformą na plac budowy w zakładzie głównym Orlenu, odpowiada DSV - Global Transport and Logistics, jeden z największych na świecie operatorów logistycznych. Przed nami dwie bardzo wymagające operacje - powiedział we wtorek dziennikarzom na płockim nabrzeżu Wisły dyrektor polskiego działu tej firmy Grzegorz Samoć. Jak wyjaśnił, najpierw przeprowadzony zostanie metodą przesuwu, z wykorzystaniem siłowników hydraulicznych, wyładunek z barek na samojezdną platformę większej konstrukcji, czyli kolumny koncentracyjnej, mierzącej 89,5 metra długości i ważącej około 555 ton. - . Aby dostać się na teren budowy, z racji średnicy kolumny, nie przejedziemy bramą Orlenu, ale w miejscu specjalnie do tego przygotowanym, gdzie zdemontowany został płot i utwardzono nawierzchnię - zaznaczył szef polskiego działu DSV - Global Transport and Logistics. Dodał, że na przyszły tydzień planowany jest rozładunek z barek i transport drogowy - z wykorzystaniem identycznych metod i środków - drugiej, mniejszej konstrukcji, czyli kolumny frakcji butadienowej C4 o długości 68,5 metra i wadze około 288 ton. Samoć wyjaśnił, że w obu przypadkach, do przewiezienia tych wielkogabarytowych elementów wykorzystana zostanie specjalna, samojezdna platforma, prawdopodobnie o 32. osiach, która na trasie z nabrzeża Wisły na plac budowy w Orlenie, liczącej około 8 km, poruszać się będzie z prędkością 1 do 2 km na godzinę. Zaznaczył, że rozładunek kolumn z barek i następnie przewiezienie ich na platformach, jak w poprzednich etapach transportu, wymagają precyzji i wielu szczegółowych obliczeń. - . Trzeba więc barki balastować. Do tego wykorzystanych zostanie kilkaset ton wody, by uniknąć sytuacji, że w trakcie uwalniania z ładunku barki nadmiernie zaczną się wynurzać - powiedział. We wtorek w przygotowaniach do rozładunku barek uczestniczyli m.in. nurkowie, którzy sprawdzali dno Wisły w bezpośrednim sąsiedztwie nabrzeża, gdzie cumują jednostki z kolumnami dla Orlenu. - Transport morski wymagał zaangażowania specjalistycznego statku z dźwigami. Pogoda była kiepska. Finalnie był to jednak standardowy rejs. Natomiast Wisłą z Gdańska do Płocka przypłynęliśmy „na ostatniej wodzie”. Gdyby teraz trzeba było wypłynąć ,poziom rzeki jest już byt niski, żeby dotrzeć na miejsce - podkreślił dyrektor polskiego działu DSV - Global Transport and Logistics. W Gdańsku, aby umożliwić przeładunek kolumn ze statku na barki rzeczne, konieczne było wykorzystanie lodołamaczy, które kruszyły pokrywę lodu, mającą miejscami grubość 40 cm - dzięki temu barki mogły wpłynąć na teren portu. Z kolei w Płocku do transportu drogowego tych konstrukcji konieczne jest przygotowanie dróg lokalnych, np. usunięcie znaków drogowych czy tablic informacyjnych. DSV - Global Transport and Logistics już wcześniej realizował podobne transporty wodne i drogowe wielkogabarytowych elementów dla Orlenu. Wśród nich w 2023 r. była m.in. ważąca ponad 850 ton kolumna „Wash Tower” o długości ponad 94 metrów, która w ramach budowy kompleksu Olefiny III przetransportowana została najpierw statkiem z Hiszpanii do Gdańska, potem na barkach Wisłą do Płocka, a następnie samojezdną platformą drogami do głównego zakładu produkcyjnego koncernu. Był to wtedy największy, pod względem wagi oraz długości, wielkogabarytowy transport zrealizowany w Polsce. W grudniu 2024 r. obecny zarząd Orlenu zdecydował o zatrzymaniu projektu budowy kompleksu Olefiny III w obowiązującym wtedy zakresie i jednocześnie postanowił prowadzić dalsze prace w ramach projektu Nowa Chemia, opartego o nowe założenia, w tym technologiczne, operacyjne i biznesowe. Projekt ten zakłada powstanie nowoczesnej instalacji do produkcji monomerów oraz zwiększenie możliwości sprzedażowych w obszarze tlenku etylenu i glikoli, styrenu oraz frakcji butadienowej C4 „w wolumenie zoptymalizowanym do potrzeb rynkowych”. Orlen argumentował, że decyzja o wstrzymaniu budowy kompleksu Olefiny III we wcześniejszym zakresie uchroni koncern przed stratą około 15 mld zł. W Płocku znajduje się główny zakład Orlenu, największy kompleks rafineryjno-petrochemiczny w Polsce, strategiczny dla bezpieczeństwa energetycznego kraju, zarazem jeden z największych tego typu w Europie. (PAP) mb/ drag/","https://www.bankier.pl/wiadomosc/Giganty-z-Chin-dotarly-do-Plocka-Rusza-skomplikowany-transport-kolumn-do-Orlenu-9099709.html"
"2026-03-17","Bankier","ORLEN S.A.: Dopuszczenie obligacji GMTN uzupełniającej emisji serii C do obrotu na rynku regulowanym prowadzonym przez Euronext Dublin","Raport bieżący nr / 2026 Data sporządzenia: 2026-03-17 Skrócona nazwa emitenta ORLEN S.A. Temat Dopuszczenie obligacji GMTN uzupełniającej emisji serii C do obrotu na rynku regulowanym prowadzonym przez Euronext Dublin Podstawa prawna Art. 56 ust. 1 pkt 2 Ustawy o ofercie – informacje bieżące i okresowe Treść raportu: ORLEN S.A. („ORLEN”) informuje, że 17 marca 2026 roku 1 250 obligacji imiennych o łącznej wartości nominalnej 250 000 000 USD zostało dopuszczonych do obrotu na rynku regulowanym prowadzonym przez Euronext Dublin. Obligacje zostały wyemitowane w ramach drugiej transzy obligacji serii C w ramach globalnego programu emisji obligacji średnioterminowych („GMTN”). Patrz także: raport bieżący nr 9/2026 z 13 marca 2026 roku. Admission of GMTN bonds from the tap issuance of series C to trading on the regulated market operated by Euronext Dublin Regulatory announcement no 10/2026 dated 17 March 2026 ORLEN S.A. (“ORLEN”) announces that on 17 March 2026, 1,250 registered bonds with a total nominal value of USD 250 000 000 were admitted to trading on the regulated market operated by Euronext Dublin. The bonds were issued as part of the second tranche of series C bonds under the global medium term note programme (“GMTN”). See also: regulatory announcement no 9/2026 of 13 March 2026 ORLEN SPÓŁKA AKCYJNA (pełna nazwa emitenta) ORLEN S.A. Paliwowy (pal) (skrócona nazwa emitenta) (sektor wg. klasyfikacji GPW w W-wie) 09-411 Płock (kod pocztowy) (miejscowość) Chemików (ulica) (numer) 24 256 81 80 24 367 77 11 (telefon) (fax) ir@orlen.pl www.orlen.pl (e-mail) (www) 774 00 01 454 610188201 (NIP) (REGON) Data Imię i Nazwisko Stanowisko/Funkcja Podpis 2026-03-17 Sławomir Jędrzejczyk Wiceprezes Zarządu 2026-03-17 Marcin Wasilewski Członek Zarządu","https://www.bankier.pl/wiadomosc/ORLEN-S-A-Dopuszczenie-obligacji-GMTN-uzupelniajacej-emisji-serii-C-do-obrotu-na-rynku-regulowanym-prowadzonym-przez-Euronext-Dublin-9099911.html"
