"data","zrodlo","tytul","tresc","link"
"2026-06-10","Bankier","Co z local content? MAP otwarte na rozmowy, a kodeks dobrych praktyk jest już w ostatniej","Ministerstwo Aktywów Państwowych jest otwarte na pomysły dotyczące wdrażania idei local content. Kodeks dobrych praktyk w tym obszarze jest w ostatniej fazie konsultacji i w najbliższym czasie może zostać podpisany przez premiera - poinformowała wiceminister aktywów państwowych Eliza Zeidler. ""Local content to priorytet nie tylko Ministerstwa Aktywów Państwowych, ale priorytet rządu premiera Donalda Tuska na drugą część kadencji. To idea, którą staramy się wdrożyć, ale właśnie poprzez rozmowy. To nie jest coś, co chcemy jednoznacznie narzucić, bo local content to zmiana sposobu myślenia. To podejście do budowy silnej polskiej gospodarki przez zwrócenie uwagi na to, co w kraju najlepsze, czyli na to, żeby kompetencje, usługi, produkty znajdować w Polsce, jeżeli jest to możliwe"" - powiedziała sekretarz stanu w Ministerstwie Aktywów Państwowych Eliza Zeidler, otwierając debatę PAP Biznes pt. „Local content - jak zbudować własny łańcuch wartości”. ""Wsłuchujemy się we wszystkie sugestie, rekomendacje, aby ta idea i ten projekt był jak najlepiej zrealizowany. Jesteśmy otwarci, jeżeli są dobre pomysły, żeby ten projekt rozwijać i będziemy wsłuchiwać się w te głosy, ażeby wspólnie budować odporną i bezpieczną polską gospodarkę"" - dodała wiceminister. Jak wskazała Zeidler, nie chodzi o naruszanie unijnych, czy krajowych regulacji, a o inne podejście. ""Staramy się pokazać, że najniższa oferta nie jest najlepszą ofertą, a chcemy poszukiwać tej najlepszej oferty, budując kompetencje i pozostawiając jak najwięcej z tego, co możliwe w Polsce, w polskich podmiotach, u polskich przedsiębiorców, polskich obywateli"" - powiedziała wiceminister. Zauważyła, że local content nie zadziała od razu. ""To wymaga długofalowej pracy, zaangażowania, determinacji, również, a może przede wszystkim, po stronie zarządów spółek, które będą podejmowały decyzje zgodnie z obowiązującymi regulacjami, ale też będą pokazywały, jak należy ten sposób myślenia zmieniać, jak należy poszukiwać na rynku tego, co jest potrzebne"" - powiedziała. ""Ministerstwo Aktywów Państwowych robi kolejne kroki, czyli KPI dla zarządów, aby to zarządy przejęły na siebie nieco więcej odpowiedzialności za realizację tego priorytetu"" - dodała. Resort przygotował też kodeks dobrych praktyk, w którym znajdą się wytyczne dot. local content dla spółek Skarbu Państwa. ""Jest on w ostatniej fazie konsultacji i myślę, że uzyska w najbliższym czasie podpis premiera, co pozwoli nam na kolejne kroki, przygotowywanie wytycznych"" - powiedziała wiceminister. Wskazała ponadto, że spółki Skarbu Państwa powołują pełnomocników do spraw local content do odpowiedniej koordynacji tej tematyki. W organizowanej przez PAP Biznes debacie pt. „Local content - jak zbudować własny łańcuch wartości” udział wzięli przedstawiciele Grupy Orlen, PGE, Grupy Tauron, Grupy Asseco, Apatora, Holcim i Głównego Urzędu Statystycznego. (PAP Biznes) pel/ pr/ osz/","https://www.bankier.pl/wiadomosc/MAP-otwarte-na-rozmowy-ws-local-content-kodeks-dobrych-praktyk-w-ostatniej-fazie-konsultacji-Zeidler-MAP-9148918.html"
"2026-06-10","Bankier","Local content to proces na lata, rząd i firmy wskazują kierunki wdrażania","Local content wymaga zmian w podejściu zakupowym i współpracy z rynkiem - wskazują uczestnicy debaty PAP Biznes. Rząd kończy prace nad kodeksem dobrych praktyk, firmy chcą doprecyzowania zasad budowy krajowego łańcucha dostaw oraz bezpieczeństwa inwestycji, a GUS przygotowuje pilotaż i system pomiaru wpływu local content na gospodarkę. W debacie organizowanej przez PAP Biznes pt. „Local content - jak zbudować własny łańcuch wartości”, udział wzięli: Ireneusz Fąfara, prezes Grupy Orlen, Dariusz Lubera, prezes PGE, Adam Bernacki, dyrektor Departamentu Zakupów i Administracji Tauron Dystrybucja, Tomasz Bendlewski, wiceprezes Asseco, Bogusław Lasek, członek zespołu zarządzającego Holcim, Monika Pietkiewicz, rzecznik prasowy Grupy Apator i Renata Bielak, wiceprezes Głównego Urzędu Statystycznego. Otwierając debatę wiceminister aktywów państwowych Eliza Zeidler zauważyła, że resort jest otwarty na pomysły dotyczące wdrażania idei local content. ""Local content to zmiana sposobu myślenia. To podejście do budowy silnej polskiej gospodarki przez zwrócenie uwagi na to, co w kraju najlepsze, czyli na to, żeby kompetencje, usługi, produkty znajdować w Polsce, jeżeli jest to możliwe. (...) Wsłuchujemy się we wszystkie sugestie, rekomendacje, aby ta idea i ten projekt był jak najlepiej zrealizowany. Jesteśmy otwarci, jeżeli są dobre pomysły, żeby ten projekt rozwijać i będziemy wsłuchiwać się w te głosy, ażeby wspólnie budować odporną i bezpieczną polską gospodarkę"" - powiedziała wiceminister Eliza Zeidler. Zauważyła, że local content nie zadziała od razu. ""To wymaga długofalowej pracy, zaangażowania, determinacji, również, a może przede wszystkim, po stronie zarządów spółek, które będą podejmowały decyzje zgodnie z obowiązującymi regulacjami, ale też będą pokazywały, jak należy ten sposób myślenia zmieniać, jak należy poszukiwać na rynku tego, co jest potrzebne"" - powiedziała. Poinformowała, że przygotowany przez MAP kodeks dobrych praktyk, w którym znajdą się wytyczne dot. local content dla spółek Skarbu Państwa, jest w ostatniej fazie konsultacji i może w najbliższym czasie zostać podpisany przez premiera. Przedstawiciele spółek zgodzili się, że wdrażanie idei local content wymaga czasu. ""Mamy wszyscy świadomość, że local content to nie jest czarodziejska różdżka, która cudownie zadziała, a proces zainicjowany przez polski rząd"" - powiedział prezes PGE Dariusz Lubera. Prezes PGE zwrócił uwagę, że local content to nie tylko same inwestycje, ale i późniejszy serwis. ""To nie jest tak, że wszystko można zrobić od razu. Prace w grupie trwają. Powołani są pełnomocnicy do spraw local content w każdej linii biznesowej i rozpoczyna się już praca u podstaw, włącznie z wdrożoną strategią local content w grupie, która zostaje przenoszona na poszczególne linie biznesowe"" - powiedział Lubera. Zwrócił uwagę, że w branży energetycznej nie ma polskich dostawców dla niektórych komponentów, np. turbin. ""Natomiast w pozostałych elementach łańcucha dostaw jest bardzo istotne, żeby local content dotyczył nie tylko głównego wykonawcy, ale żeby on na tych samych zasadach również przenosił to na drugiego podwykonawcę itd."" - powiedział. Lubera poinformował, że firma przed rozpoczęciem postępowania prowadzi dialog z potencjalnymi dostawcami, a zainteresowanie jest coraz większe. ""Jeżeli będzie świadomość tego, że jest to proces na lata, to jestem spokojny, że osiągniemy efekty w local content, również w PGE"" - powiedział prezes Lubera. Ireneusz Fąfara, prezes Orlenu, poinformował, że grupa również przygotowuje się do wdrażania local content zarówno wewnętrznie, jak i poprzez rozmowy z potencjalnymi dostawcami. ""Zewnętrzne zorganizowaliśmy Forum Partnerów Energii Jutra. Aby zachęcić firmy polskie do tego, by współdziałały z nami przy realizacji naszej strategii, organizujemy w różnych miejscach kraju spotkania, pokazujemy dotychczasowym i potencjalnym partnerom to, co zamierzamy zrobić, jak to zamierzamy zrobić i kiedy. Dla wielu firm to pierwszy kontakt z Orlenem, z dość skomplikowanymi procedurami. Mamy bardzo dobry odzew"" - powiedział prezes Orlenu. Jak dodał, w ramach grupy Orlen trwają prace nad uproszczeniem wewnętrznych procedur. ""Myślimy w kategoriach zakupów towarów, usług, a mniej myślimy o innym komponencie, jakim są koszty pracy. Możemy część usług kupować u wyspecjalizowanych firm niepolskich, ale możemy tak sformułować warunki przetargu, aby w tym uczestniczyły polskie firmy i dlatego ten komponent kosztów pracy jest niezwykle istotny"" - powiedział Fąfara. Adam Bernacki, dyrektor Departamentu Zakupów i Administracji w Tauron Dystrybucja, wskazał, że trzeba rozdzielić chęć współpracy z polskimi przedsiębiorcami od bardzo aktywnego wpływania na to, żeby w tym łańcuchu dostaw rosła zawartość komponentu krajowego. ""Local content nie zmieni naszej rzeczywistości, tylko dlatego, że opublikowaliśmy definicję. To jest szereg prac, które mogą sprzyjać temu, żebyśmy za rok, za dwa lata zwiększyli zawartość komponentu krajowego w łańcuchu dostaw"" - powiedział dyrektor. ""Nie widzę w local content rewolucji. Widzę po prostu zielone światło dla mądrego kupowania"" - dodał. Jak poinformował dyrektor Tauron Dystrybucja, w tym roku w spółce 98 proc. CAPEX-u zostanie wydane w relacji z polskimi przedsiębiorstwami. Spółka rozpoczęła też prace nad własnym modelem monitorowania local content. ""To wymaga oczywiście pewnej odwagi w podejściu do prawa zamówień publicznych, ale prawo zamówień publicznych nie jest żadną przeszkodą. (...) Dla mnie osobiście ta zmiana w podejściu jest szansą na to, żeby kupować w sposób dużo mądrzejszy i profesjonalny. Widzę w tym szansę na profesjonalizację procesu zakupów, to warunek, by osiągnąć local content"" - powiedział. ""Musimy skończyć z formalistyczno-administracyjnym podejściem. Dzisiaj zarządzanie zakupami zaczyna się dużo wcześniej - od dialogu z wykonawcami, z dostawcami, z partnerami biznesowymi po to, żeby poznać dokładnie warunki, w jakich funkcjonują, aby zbudować relację, która będzie budowała bezpieczeństwo i będzie dawała szansę uczestniczenia w postępowaniu. (...) Duże przetargi dzielimy na szereg mniejszych zadań, żeby umożliwić uczestniczenie małym i średnim przedsiębiorstwom. Wprowadzamy warunki, które eliminują nieuczciwą konkurencję i wprowadzamy je odważnie"" - dodał Bernacki. Monika Pietkiewicz, rzecznik prasowy Grupy Apator, ostrzegła przed nieuczciwą konkurencją z państw trzecich. ""Tracimy rynek na rzecz nieuczciwych konkurentów z państw trzecich, którzy wykorzystują to, że są subwencjonowani, dotowani i my już na starcie jesteśmy 10-40 proc. drożsi. Nie możemy więc konkurować ceną. (...) Musimy działać w ramach prawa zamówień publicznych i ono nie pozwala preferować lokalnych oferentów, ale możemy wykorzystywać pewne mechanizmy, aby zwiększać local content naszych zakupów, naszych inwestycji - mamy precedensowe orzeczenia TSUE, czy ciekawy wyrok KIO"" - powiedziała Monika Pietkiewicz. Wskazała, że dla bezpieczeństwa energetycznego priorytetowa powinna być weryfikacja dostawców technologii stosowanych w infrastrukturze krytycznej. ""Nie wprowadzajmy koni trojańskich do naszej sieci. Weryfikujmy producentów technologii, a nie tylko europejskich dystrybutorów chińskich produktów, bo dziś konkurencja śmieje się z luk w systemie"" - powiedziała. Jak wskazała, postulowana weryfikacja pochodzenia produktów i podmiotów jest absolutnie kluczowe w infrastrukturze krytycznej. ""Po drugie, systemy certyfikacji audytów bezpieczeństwa. Nie polegajmy na deklaracjach dostawców. (...) Mamy bardzo duże środki na transformację energetyczną, bardzo dużo pieniędzy jest w gospodarce, co sprawia, że jest bardzo dużo firm z całego świata, które chcą te pieniądze skonsumować - mamy napływ konkurencji i jako Apator, postulujemy, aby uwarunkować wsparcie publiczne - nie transferować pieniędzy z dotacji, z KPO do państw trzecich, tylko obwarować to obowiązkiem pozostawienia tego w gospodarce - w firmie polskiej czy w europejskiej. Ważne, żeby te pieniądze zostały w Europie i pracowały na naszą gospodarkę"" - powiedziała Pietkiewicz. Tomasz Bendlewski, wiceprezes Asseco, zwrócił uwagę, że local content dotyczy tylko podmiotu, a nie produktu. ""Możemy założyć polską firmę, kupić chiński produkt i spełnić 100 proc. wymagań local content, a produkt nadal może być niebezpieczny"" - powiedział wiceprezes Asseco. ""Tę lukę uzupełnia nam NIS 2, przynajmniej, jeżeli chodzi o sektor energetyczny, który jest całkowicie infrastrukturą krytyczną. NIS 2 nakładać będzie na przedsiębiorstwa obowiązek analizy procesu wytwarzania i czy ten produkt jest jakościowy i bezpieczny"" - powiedział Bendlewski. Jego zdaniem, należy połączyć ideę local contentu z dyrektywą NIS 2 i suwerennością danych. Bogusław Lasek, członek zespołu zarządzającego Holcim, ocenił, że definicję local contentu należałoby doszczegółowić. ""W definicji local contentu trochę nam brakuje miejsca wytwarzania produktu. My jako Holcim Polska jesteśmy na tym rynku 30 lat, mamy 70 zakładów produkcyjnych, ponad 2000 pracowników, ponad 3,5 miliarda zł inwestycji, rocznie odprowadzamy do budżetu państwa w podatkach pośrednich i bezpośrednich ponad 500 milionów złotych. Corocznie inwestujemy bardzo duże pieniądze w rozwój naszych linii technologicznych i przygotowanie się do realizacji m.in. projektów strategicznych. W myśl definicji local content tracimy 25 proc. oceny przez to, że naszą spółką założycielska ma siedzibę w Szwajcarii. ""Spełniając - w naszej ocenie - wszystkie podstawowe kryteria oceny polskości w tym biznesie, trochę na tym tracimy, więc z naszego punktu widzenia bardzo ważne jest, jak doprecyzujemy tę definicję local content"" - dodał. Poinformował, że w ubiegłym roku spółka miała 94 proc. komponentu krajowego w swoich zakupach, czyli ponad 2 mld zł, które corocznie wydaje na usługi i zakupy surowców, pozostało w Polsce. ""Z naszej perspektywy jesteśmy gotowi. Jesteśmy też gotowi rozmawiać ze spółkami Skarbu Państwa, żeby wspierać je w realizacji celów związanych z realizacją local contentu"" - powiedział członek zespołu zarządzającego Holcim. ""Potrzebujemy stabilności w strategiach i w decyzjach spółek Skarbu Państwa. Inwestując w nowe linie, w nowe procesy musimy mieć stabilność i legislacyjną i decyzyjną, która nam pozwoli podejmować decyzje inwestycyjne"" - dodał. Wiceprezeska GUS ds. statystyki gospodarczej, Renata Bielak, wskazała, że GUS chce integrować różne źródła informacji, aby w przyszłości móc badać wpływ local contentu na całą gospodarkę. ""Na podstawie źródeł administracyjnych, przepływów w systemie JPK VAT szacujemy lokal content - robiliśmy takie ćwiczenie i jesteśmy to w stanie wyszacować. (...) Z drugiej strony będziemy mieli wyniki badania, które za chwileczkę rusza w ramach pilotażu. Z trzeciej strony - mamy cały zasób informacyjny wskaźników makroekonomicznych i będziemy dążyć do tego, żeby integrować te różne źródła informacji i analizować lokal content i sektorowo, i dla całej gospodarki"" - powiedziała podczas debaty Bielak. ""Mamy świadomość, że badanie wymaga rozwoju. Będziemy je doskonalić i rozwijać w taki sposób, żeby w przyszłości być w stanie oceniać nie tylko udziału krajowych podmiotów w projektach inwestycyjnych, ale też mierzyć oddziaływanie lokal contentu na gospodarkę jako całość, na poszczególne segmenty gospodarcze. Takie są nasze ambicje, chcemy budować kompleksowy system monitorowania lokal contentu"" - dodała Bielak. Główny Urząd Statystyczny planuje w połowie roku uruchomienie pilotażu dotyczącego pomiaru local content w sektorze energetycznym. ""Jesteśmy na etapie startowania z pilotażem, jest on przygotowany i traktujemy go jako bardzo praktyczne ćwiczenie. W ramach pilotażu chcemy wkroczyć do kilku spółek Skarbu Państwa, nadzorowanych przez Ministerstwo Aktywów Państwowych. Ministerstwo wskaże nam projekty, które będziemy badać. Zgodnie z założeniami pilotażu będziemy zadawać pytania, przygotowane w tym badaniu - będą one kierowane do wykonawców projektów i do podwykonawców na dwóch poziomach"" - powiedziała Bielak. ""W ramach pilotażu będziemy chcieli przetestować przede wszystkim, czy pytania, które formułujemy do podmiotów, są jednoznacznie zrozumiałe i czy informacje, które uzyskamy w ramach tego badania, będą wystarczające do oceny udziału przedsiębiorstw krajowych w projektach inwestycyjnych"" - dodała. Jak wskazała, w ramach badania GUS będzie pytał przede wszystkim o udział komponentu krajowego w trzech aferach - koszty pracy, usługi i zakupy towarów. ""Jeżeli czegoś nie jesteśmy w stanie zmierzyć, to nie potrafimy tym zarządzać. Dlatego Główny Urząd Statystyczny przygotowuje standard pomiaru local content, żebyśmy w dyskusjach mogli posługiwać się faktami"" - powiedziała wiceprezes GUS. (PAP Biznes) pel/ pr/ asa/","https://www.bankier.pl/wiadomosc/DEBATA-PAP-BIZNES-Local-content-to-proces-na-lata-rzad-i-firmy-wskazuja-kierunki-wdrazania-9149117.html"
"2026-06-10","Bankier","Windfall tax coraz bliżej. Rząd łasi się na 5 mld złotych z sektora paliwowego","Projekt ustawy o podatku od nadzwyczajnych zysków ze zbycia paliw ciekłych osiągniętych w okresie od marca do grudnia 2026 r. znalazł się w porządku czwartkowych obrad Stałego Komitetu Rady Ministrów (SKRM) - wynika z agendy spotkania. Pod koniec maja Minister Finansów i Gospodarki skierował do konsultacji zmodyfikowany projekt ustawy podatku od nadzwyczajnych zysków z tytułu wytwarzania niektórych paliw ciekłych i ich obrotu osiągniętych w 2026 r. Szacowana wysokość podatku od nadzwyczajnych zysków (75 proc. podstawy opodatkowania) za okres od marca do grudnia 2026 r. wyniosłaby 5 mld zł, z tego szacowane wpłaty w 2026 r. wyniosą 4,75 mld zł, a w 2027 r. 0,25 mld zł (zaliczka za grudzień 2026 r.). Podstawa opodatkowania dla Orlenu szacowana jest na 4 mld zł. W projekcie zaproponowano też, aby koncerny paliwowe zapłaciły pierwszą zaliczkę podatku windfall tax do 25 sierpnia za okres od 1 marca do 31 lipca. (PAP Biznes) jz/ asa/","https://www.bankier.pl/wiadomosc/Projekt-dot-podatku-windfall-tax-na-agendzie-SKRM-w-czwartek-9149219.html"
"2026-06-10","PAP","Zeidler: MAP otwarte na rozmowy ws. local content, kodeks dobrych praktyk w ostatniej fazie konsultacji [WIDEO]","Ministerstwo Aktywów Państwowych jest otwarte na pomysły dotyczące wdrażania idei local content. Kodeks dobrych praktyk w tym obszarze jest w ostatniej fazie konsultacji i w najbliższym czasie może zostać podpisany przez premiera - poinformowała wiceminister aktywów państwowych Eliza Zeidler. ""Local content to priorytet nie tylko Ministerstwa Aktywów Państwowych, ale priorytet rządu premiera Donalda Tuska na drugą część kadencji. To idea, którą staramy się wdrożyć, ale właśnie poprzez rozmowy. To nie jest coś, co chcemy jednoznacznie narzucić, bo local content to zmiana sposobu myślenia. To podejście do budowy silnej polskiej gospodarki przez zwrócenie uwagi na to, co w kraju najlepsze, czyli na to, żeby kompetencje, usługi, produkty znajdować w Polsce, jeżeli jest to możliwe"" - powiedziała sekretarz stanu w Ministerstwie Aktywów Państwowych Eliza Zeidler, otwierając debatę PAP Biznes pt. „Local content - jak zbudować własny łańcuch wartości”. ""Wsłuchujemy się we wszystkie sugestie, rekomendacje, aby ta idea i ten projekt był jak najlepiej zrealizowany. Jesteśmy otwarci, jeżeli są dobre pomysły, żeby ten projekt rozwijać i będziemy wsłuchiwać się w te głosy, ażeby wspólnie budować odporną i bezpieczną polską gospodarkę"" - dodała wiceminister. Jak wskazała Zeidler, nie chodzi o naruszanie unijnych, czy krajowych regulacji, a o inne podejście. Zeidler: staramy się pokazać, że najniższa oferta nie jest najlepszą ofertą, a chcemy poszukiwać tej najlepszej oferty ""Staramy się pokazać, że najniższa oferta nie jest najlepszą ofertą, a chcemy poszukiwać tej najlepszej oferty, budując kompetencje i pozostawiając jak najwięcej z tego, co możliwe w Polsce, w polskich podmiotach, u polskich przedsiębiorców, polskich obywateli"" - powiedziała wiceminister. Zauważyła, że local content nie zadziała od razu. ""To wymaga długofalowej pracy, zaangażowania, determinacji, również, a może przede wszystkim, po stronie zarządów spółek, które będą podejmowały decyzje zgodnie z obowiązującymi regulacjami, ale też będą pokazywały, jak należy ten sposób myślenia zmieniać, jak należy poszukiwać na rynku tego, co jest potrzebne"" - powiedziała. ""Ministerstwo Aktywów Państwowych robi kolejne kroki, czyli KPI dla zarządów, aby to zarządy przejęły na siebie nieco więcej odpowiedzialności za realizację tego priorytetu"" - dodała. Resort przygotował też kodeks dobrych praktyk, w którym znajdą się wytyczne dot. local content dla spółek Skarbu Państwa. ""Jest on w ostatniej fazie konsultacji i myślę, że uzyska w najbliższym czasie podpis premiera, co pozwoli nam na kolejne kroki, przygotowywanie wytycznych"" - powiedziała wiceminister. Wskazała ponadto, że spółki Skarbu Państwa powołują pełnomocników do spraw local content do odpowiedniej koordynacji tej tematyki. W organizowanej przez PAP Biznes debacie pt. „Local content - jak zbudować własny łańcuch wartości” udział wzięli przedstawiciele Grupy Orlen, PGE, Grupy Tauron, Grupy Asseco, Apatora, Holcim i Głównego Urzędu Statystycznego. (PAP Biznes) pel/ pr/ osz/gn/","https://www.pap.pl/aktualnosci/map-otwarte-na-rozmowy-ws-local-content-kodeks-dobrych-praktyk-w-ostatniej-fazie"
"2026-06-09","Bankier","Co czeka Pocztę Polską i Polska Press? Balczun: Idę wyznaczonym szlakiem","Mam swoje cele, idę wyznaczonym szlakiem. (...) Dużo jeszcze też przed nami trudnych spraw - powiedział we wtorkowej „Gazecie Wyborczej” minister aktywów państwowych Wojciech Balczun. Jednym z tematów, który został poruszony w wywiadzie była fuzja Poczty Polskiej z Orlen Paczką. Szef resortu aktywów państwowych Wojciech Balczun w wywiadzie dla „Gazety Wyborczej” powiedział, że zupełnie się nie przejmuje plotkami na temat swojego odejścia z powierzonej mu funkcji. „Mam naprawdę grubą skórę i dużą odporność. Mam też swoje cele, idę wyznaczonym szlakiem i szczerze mówiąc, nie mam nawet ochoty słuchać tych spekulacji, dlatego że odciągają mnie tylko od meritum” - powiedział Balczun. Mamy swoją agendę od samego początku i po kolei odhaczamy z niej rzeczy, które zostały zaopiekowane. Dużo jeszcze też przed nami trudnych spraw - przyznał minister aktywów państwowych. Podczas rozmowy została poruszona również kwestia sprzedaży sieci automatów paczkowych Orlenu albo wydawnictwa Polska Press, lecz - jak przyznał - „oba te podmioty, czyli Orlen Paczka i Polska Press, znajdują się na agendzie pod kątem poszukiwania potencjalnego inwestora”. Dopytywany o to, czy temat fuzji z Pocztą Polską i Orlen Paczką jest już zamknięty, odpowiedział, że widzi tam przestrzeń na kooperację biznesową, ale niekoniecznie kapitałową. „Poczta Polska ma ogromne potrzeby inwestycyjne, zwłaszcza w sferze IT i podnoszenia standardów obsługi klientów w placówkach. Biznesowo nie utraciła wszystkich kompetencji na rynku paczek, natomiast realizacja takiej transakcji wiązałaby się z gigantycznym nakładem inwestycyjnym. Poczty w tej chwili na to nie stać” - przyznał Balczun. Minister przypomniał także, że od 1 czerwca zarząd poczty Polskiej ma nową prezes - Magdalenę Gaj i jak twierdzi „znajdzie się tu synergia biznesowa i połączenie potencjałów, które podniosą wartość obu podmiotów - zarówno Poczty, jak i Orlenu” - powiedział Wojciech Balczun.(PAP) azk/ sp/","https://www.bankier.pl/wiadomosc/Co-czeka-Poczte-Polska-i-Polska-Press-Balczun-Mam-swoje-cele-ide-wyznaczonym-szlakiem-9147932.html"
