"data","zrodlo","tytul","tresc","link"
"2026-03-30","Bankier","Magdalena Kamińska powołana na stanowisko prezesa Energi","„Zarząd spółki Energa SA (...) informuje, że w dniu 30 marca 2026 roku Rada Nadzorcza Spółki podjęła uchwały o: powierzeniu, w miejsce dotychczasowej funkcji Wiceprezesa Zarządu ds. Finansowych, od 1 kwietnia 2026 roku Pani Magdalenie Kamińskiej funkcji Prezesa Zarządu Energa S.A. VIII Kadencji, powołaniu, od 1 kwietnia 2026 roku, Pana Przemysława Janiaka w skład Zarządu Spółki VIII kadencji i powierzeniu funkcji Wiceprezesa Zarządu” - przekazała Energa. Od 4 lutego 2025 roku Kamińska pełniła stanowisko wiceprezes Energi ds. finansowych. Jak poinformowała spółka, nowa prezes ma kilkunastoletnie doświadczenie w zarządzaniu finansami. Jest absolwentką Wydziału Ekonomii Uniwersytetu Gdańskiego, a karierę zawodową rozpoczynała w 2007 roku w międzynarodowych firmach audytorskich - EY i Deloitte. Z Grupą Energa związana jest od 2011 roku. Pełniła funkcję zastępcy dyrektora, a następnie dyrektora departamentu finansów. Uczestniczyła w strategicznych projektach inwestycyjnych, pozyskiwaniu finansowania dla Grupy, a także w integracji z Grupą Orlen. Od lipca 2024 roku pełniła funkcję wiceprezesa spółki Energa Wytwarzanie. Jest członkinią rady nadzorczej należącej do Grupy Energa spółki Baltic Service Offshore Solutions. Zasiada w Radzie Zarządzającej Polskiego Komitetu Energii Elektrycznej. Z kolei, jak poinformowała Energa, Przemysław Janiak to menedżer z kilkunastoletnim doświadczeniem zawodowym w sektorze energetycznym. Karierę rozpoczął w 2010 roku w EY, realizując projekty dla kluczowych podmiotów z branży energetycznej. Od 2016 roku związany z Grupą Kapitałową Orlen, gdzie odpowiadał za obszar strategicznych analiz inwestycyjnych i rynkowych oraz rynek mocy. Był zaangażowany w realizację inwestycji w bloki gazowo-parowe, morskie farmy wiatrowe, elektrociepłownie przemysłowe, farmy fotowoltaiczne oraz magazyny energii. Od 2020 roku współpracował z Grupą Energa w obszarze strategii, przygotowania i realizacji inwestycji w źródła gazowe, ciepłownicze oraz morską energetykę wiatrową. Jest absolwentem studiów ekonomicznych w Szkole Głównej Handlowej w Warszawie oraz studiów podyplomowych w zakresie morskiej energetyki wiatrowej na Politechnice Gdańskiej. Ukończył szereg kursów menedżerskich realizowanych przez m.in. Harvard Business School, NYU Stern School of Business i University of Oxford. Grupa Energa to jedna z czterech największych grup energetycznych działających w Polsce. Jej sieć dystrybucyjna ma obecnie 200 tys. km, obejmując mniej więcej 1/4 kraju i zasilając około 3,4 mln klientów. Od 2020 r. Grupa Energa należy do Grupy Orlen. (PAP) gkc/ mrr/","https://www.bankier.pl/wiadomosc/Magdalena-Kaminska-powolana-na-stanowisko-prezesa-Energi-od-1-IV-9106544.html"
"2026-03-30","Bankier","Sieci gotowe na zieloną energię? Setki milionów do inwestycji Energi i Tauronu","Jak wynika z poniedziałkowej informacji MKiŚ, Narodowy Fundusz Ochrony i Środowiska Gospodarki Wodnej podpisał umowy ze spółkami dystrybucyjnymi obu koncernów. Dotyczą one m.in. finansowania budowy inteligentnej infrastruktury i zwiększenia potencjału przyłączeniowego dla źródeł odnawialnych. Spółka Energa-Operator otrzyma 470 mln zł z KPO na projekt o wartości 772 mln zł, który ma objąć 250 km linii, 17,4 tys. stacji, a także stworzyć możliwość podłączenia 262 MW OZE i zredukować straty energii o 210 MWh rocznie. Według resortu klimatu inwestycje Energi mają objąć osiem województw, głównie obszary wiejskie. Modernizowana sieć ma zostać dostosowana do rozproszonej struktury odbiorców i wytwórców oraz zyskać większą odporność na zjawiska pogodowe i wyzwania transformacji. Spółka Tauron Dystrybucja ma otrzymać 33,6 mln zł na projekt o wartości 55,1 mln zł obejmujący 16 zadań modernizacji sieci w pięciu województwach południowej Polski. Prace będą prowadzone m.in. Strumieniu, Pawłowicach, Trzebini, Chrzanowie, Niemodlinie, Grodkowie, Obornikach Śląskich, Tuchowie i Dąbrowie Tarnowskiej. Inwestycja ma wzmocnić infrastrukturę dystrybucyjną, poprawić jakość dostaw energii, a także wesprzeć rozwój OZE. Umowy o dofinansowanie podpisali w obecności wiceministra klimatu Krzysztofa Bolesty m.in. prezes NFOŚiGW Dorota Zawadzka-Stępniak, wiceprezes Energi-Operator Marek Pszonka i prezes Tauronu Dystrybucji Leszek Kosiorek. Grupa Energa to jedna z czterech największych grup energetycznych działających w Polsce. Jej sieć dystrybucyjna ma obecnie 200 tys. km, obejmując ok. jednej czwartej kraju i zasilając ok. 3,4 mln klientów. Od 2020 r. Grupa Energa należy do Grupy Orlen. Tauron Polska Energia to spółka holdingowa kierująca grupą kapitałową działającą w obszarze wytwarzania, dystrybucji i sprzedaży energii. Koncern należy do największych firm w kraju – jest największym dystrybutorem prądu w Polsce oraz jednym z czołowych jego producentów i sprzedawców.(PAP) mtb/ drag/","https://www.bankier.pl/wiadomosc/Sieci-gotowe-na-zielona-energie-Setki-milionow-do-inwestycji-Energi-i-Tauronu-9106598.html"
"2026-03-30","Bankier","Dawny GetBack już 160 procent na liczniku w tym roku. Energetyka i węgiel gwiazdami sesji","Poniedziałkowa sesja zakończyła się wzrostami głównych indeksów na GPW Średnie spółki reprezentowane przez mWIG40 zyskały 0,58%. Słabiej wypadł jedynie segment mniejszych podmiotów, gdzie sWIG80 zanotował spadek o 0,13%. Obroty na szerokim rynku wyniosły 2,18 mld zł, z czego 1,76 mld zł dotyczyło spółek z WIG20. W momencie zamknięcia notowań w Warszawie, na kluczowych rynkach zagranicznych również dominował optymizm. . Za oceanem nastroje także były sprzyjające – S&P500 zyskiwał 0,2%, natomiast technologiczny Nasdaq rósł o 0,7%. „Poniedziałkowa sesja przynosi wyraźne odbicie na rynkach akcji po wcześniejszej wyprzedaży wywołanej obawami o skutki gospodarcze wojny z udziałem Iranu. , czyli powrót inwestorów wykorzystujących atrakcyjniejsze wyceny oraz relatywnie stabilne perspektywy wyników spółek” – napisali w komentarzu analitycy TMS Oanda. „Odbiciu na rynku akcji towarzyszy spadek rentowności obligacji. Rentowność amerykańskich obligacji dziesięcioletnich spada do około 4,35 proc., a podobny kierunek obserwowany jest w Europie. Ruch ten odzwierciedla zmniejszenie obaw, że Fed będzie zmuszony do agresywnego zacieśniania polityki pieniężnej w odpowiedzi na wzrost cen energii”- dodali. , ponieważ poniedziałkowe dane o inflacji w Niemiec, W odniesieniu do sytuacji na Bliskim Wschodzie, , przypomnijmy, że prezydent USA . Z jednej strony informował o „doskonałych negocjacjach” z Iranem, z drugiej – zagroził atakiem na irańskie szyby naftowe i elektrownie, jeśli Cieśnina Ormuz nie zostanie otwarta. Dodatkowo, Trump zasygnalizował chęć „przejęcia ropy z Iranu”. Warto zauważyć, że w poniedziałek . W jego czasie stwierdził, że Fed, że nie osiągnął jeszcze punktu decyzyjnego w sprawie swojego następnego ruchu. Jest to jedno z ostatnich zaplanowanych wystąpień publicznych Powella przed końcem jego kadencji w maju, stąd jest pilnie śledzone przez rynki. Na lokalnym rynku . Zarząd spółki Tauron (13,87%) zarekomendował wypłatę 0,20 zł dywidendy na akcję. , co wywołało falę zakupów. : PGE zyskało 9,66%, a kurs Enei z mWIG40 urósł o 7,53%. Więcej o sektorze w artykule . Równie mocno lśniło „czarne złoto”. . Bogdanka wzrosła o 10,38%, a JSW zyskało 2,83%. Warto odnotować również wzrost kursu spółki Bumech o 7,09%. Sektor ten wspiera przeświadczenie, że węgiel stanie się kluczowym substytutem dla niepewnych dostaw gazu z Bliskiego Wschodu. Jak informowaliśmy w piątek ceny węgla dla energetyki są zakontraktowane na sztywno i ewentualne korekty mogą nastąpić dopiero w połowie roku, . Japonia, ogłosiła w piątek, że ​​zamierza zwiększyć wykorzystanie elektrowni węglowych. Słabo w poniedziałek zaprezentował się sektor bankowy Santander stracił 0,86%, lekko zniżkował mBank, i kursy PKO BP oraz Pekao. Wyjątkiem z tej branży w WIG20 był Alior Bank, który urósł o 0,46%. Uwagę przyciągał po fatalnym piątku (spadek o przeszło 18%). Z kolei mimo ogłoszenia przez Ministerstwo Energii cen maksymalnych na stacjach paliw (6,16 zł za litr Pb95 od wtorku), co na razie nie wystraszyło kupujących. Na szerokim rynku warto zwrócić . Brak konwersji długu na akcje oraz ustalenie warunków spłaty zadłużenia wobec m.in. Orlenu zostało odebrane przez rynek jako krok w stronę stabilizacji finansowej chemicznego giganta. Trwa raj kursu akcji dawnego GetBacku, czyli obecnie spółki Capitea (22,27%), który zyskał w tym roku już 161%. „To podmiot, który w ubiegłym roku kupował i sprzedawał duże pakiety akcji EuCO. W portfelu miał także m.in. akcje upadłego Rafako. Obecnie należy do niego pakiet spółki Milisystem” – informował Puls Biznesu. Głównym akcjonariuszem Capitei jest Radosław Barzcyński (34,7 proc.), 9,99 proc. akcji należy do DNLD Holdings, a 5,93 proc. do Quercus TFI. Na New Connect zadebiutowała spółka Farm Innovations (3,57%), , tworząc zintegrowany ekosystem usług dla sektora zwierząt towarzyszących (psy, koty), hodowlanych (bydło) i koni. Redaktor działu Rynki Bankier.pl. Absolwent finansów i rachunkowości na UMCS w Lublinie. W czasie studiów zainteresował się giełdą i rynkami finansowymi, które to zainteresowania rozwinął na SGH w Warszawie na kierunku Bankowość Inwestycyjna. Na co dzień obserwuje notowania warszawskiej giełdy, by przekazać czytelnikom portalu najważniejsze informacje z parkietu oraz przybliżyć istotne wiadomości ze spółek. Telefon 728 927 242","https://www.bankier.pl/wiadomosc/Dawny-GetBack-juz-160-procent-na-liczniku-w-tym-roku-Energetyka-i-wegiel-gwiazdami-sesji-9106658.html"
"2026-03-30","Bankier","Nie będzie na razie interwencji na rynku paliw","Poniedziałkowe posiedzenie rządu poprzedziło spotkanie z przedstawicielami największych dystrybutorów paliw w Czechach, którym premier przedstawił swoje stanowisko w sprawie marż. Jego zdaniem powinny być niższe niż stosowane obecnie. Jako przykład, że można je obniżyć, podał ceny przy głównej autostradzie kraju, które po jego rozmowach z firmami paliwowymi zostały obniżone. Ministerstwo finansów analizuje zarówno kwestię ewentualnego wprowadzenia maksymalnej stawki marży, co zdaniem rządu może wpłynąć na cenę detaliczną paliw w Czechach, jak i możliwe ingerencje podatkowe. Wciąż w grze jest także wprowadzenie podwójnych cen dla samochodów z obcą rejestracją. Premier zapowiedział, że kolejne posiedzenie rządu dotyczące cen paliw odbędzie się w czwartek. Dzień wcześniej ma dojść do kolejnego spotkania z przedstawicielami firm paliwowych: MOL, OMV, Shell, EuroOil i Orlen. - Premier przedstawił nam pewne propozycje rządu i za dwa lub trzy dni ponownie omówimy, które z nich da się zrealizować - powiedział po spotkaniu prezes zarządu Orlenu Unipetrol Mariusz Wnuk. Zaprzeczył, jakoby dystrybutorzy wykorzystywali sytuację na Bliskim Wschodzie do nieproporcjonalnego podnoszenia cen. Taki zarzut postawił wcześniej Babisz. - Stosujemy standardową politykę cenową, co oznacza, że staramy się oferować jak najbardziej konkurencyjne ceny, biorąc pod uwagę rynek detaliczny w Czechach, który jest bardzo konkurencyjny – stwierdził Wnuk. Rząd zdecydował w poniedziałek, że pożyczy krajowym rafineriom 100 tys. ton ropy z rezerw strategicznych. Ich zarząd zapewnił, że zaopatrzenie czeskiego rynku w paliwa jest normalne, paliw jest pod dostatkiem. Nie ma więc potrzeby gromadzenia zapasów benzyny i oleju napędowego. Z Pragi Piotr Górecki (PAP) ptg/ mal/","https://www.bankier.pl/wiadomosc/Nie-bedzie-na-razie-interwencji-na-rynku-paliw-9106744.html"
"2026-03-30","Bankier","ENERGA S.A.: Złożenie przez Akcjonariusza ORLEN S.A. zmian w projektach uchwał NWZ","Raport bieżący nr / 2026 Data sporządzenia: 2026-03-30 Skrócona nazwa emitenta ENERGA S.A. Temat Złożenie przez Akcjonariusza ORLEN S.A. zmian w projektach uchwał NWZ Podstawa prawna Art. 56 ust. 1 pkt 2 Ustawy o ofercie – informacje bieżące i okresowe Treść raportu: Zarząd Energa S.A. („Spółka”) informuje, że w dniu 30 marca 2026 r. do Spółki wpłynął wniosek akcjonariusza większościowego ORLEN S.A. ze zmodyfikowanymi projektami uchwał Nadzwyczajnego Walnego Zgromadzenia ENERGA S.A. zwołanego na dzień 2 kwietnia 2026 roku, które zastąpią projekty przedłożone wraz z wnioskiem Akcjonariusza z dnia 25 lutego 2026 roku. Wniosek akcjonariusza wraz ze zmodyfikowanymi projektami uchwał przekazujemy w załączeniu. Załączniki Plik Opis 1. Piamo akcjonariusza Orlen SA 2. Odpis KRS 3. Załącznik nr 2 projekt uchwały NWZ 4. Załącznik nr 3 projekt uchwały NWZ 5. Załącznik nr 4 projekt uchwały NWZ Current Report No. 14/2026 Date: 30 March 2026 Report title: Submission by Shareholder ORLEN S.A. of Amendments to Draft Resolutions of the EGM Legal basis: § 20 of the Regulation on current and periodic information The Management Board of Energa S.A. (the “Company”) announces that on 30 March 2026 the Company received a request from the majority shareholder, ORLEN S.A., containing amended draft resolutions of the Extraordinary General Meeting of ENERGA S.A. convened for 2 April 2026. These amended drafts will replace the draft resolutions submitted together with the Shareholder’s request dated 25 February 2026. The shareholder’s request together with the amended draft resolutions is published on Energa website. The only legally binding version is the Polish original. ENERGA SPÓŁKA AKCYJNA (pełna nazwa emitenta) ENERGA S.A. Energetyka (ene) (skrócona nazwa emitenta) (sektor wg. klasyfikacji GPW w W-wie) 80-309 Gdańsk (kod pocztowy) (miejscowość) Grunwaldzka (ulica) (numer) +48 58 778 83 00 +48 58 778 83 99 (telefon) (fax) (e-mail) (www) 957-095-77-22 220353024 (NIP) (REGON) Data Imię i Nazwisko Stanowisko/Funkcja Podpis 2026-03-30 Magdalena Kamińska p.o. Prezes Zarządu Energi SA, Wiceprezes Zarządu Energi SA ds. Finansowych 2026-03-30 Michał Gołębiowski Wiceprezes Zarządu Energi SA","https://www.bankier.pl/wiadomosc/ENERGA-S-A-Zlozenie-przez-Akcjonariusza-ORLEN-S-A-zmian-w-projektach-uchwal-NWZ-9106813.html"
"2026-03-30","TVN24","Setki milionów na sieci energetyczne. Ministerstwo zapowiada wielkie inwestycje","Około 500 milionów złotych z Krajowego Planu Odbudowy zasili inwestycje Energi i Tauronu w modernizację sieci elektroenergetycznych. Według informacji przekazanych przez Ministerstwo Klimatu i Środowiska, firmy otrzymają kolejno 470 i ponad 33 miliony złotych. Jak wynika z poniedziałkowej informacji MKiŚ, Narodowy Fundusz Ochrony i Środowiska Gospodarki Wodnej podpisał umowy ze spółkami dystrybucyjnymi obu koncernów. Dotyczą one m.in. finansowania budowy inteligentnej infrastruktury i zwiększenia potencjału przyłączeniowego dla źródeł odnawialnych. Spółka Energa-Operator otrzyma 470 mln zł z KPO na projekt o wartości 772 mln zł, który ma objąć 250 km linii, 17,4 tys. stacji, a także stworzyć możliwość podłączenia 262 MW i zredukować straty energii o 210 MWh rocznie. Według resortu klimatu inwestycje Energi mają objąć osiem województw, głównie obszary wiejskie. Modernizowana sieć ma zostać dostosowana do rozproszonej struktury odbiorców i wytwórców oraz zyskać większą odporność na zjawiska pogodowe i wyzwania transformacji. Spółka Tauron Dystrybucja ma otrzymać 33,6 mln zł na projekt o wartości 55,1 mln zł obejmujący 16 zadań modernizacji sieci w pięciu województwach południowej Polski. Prace będą prowadzone m.in. w Strumieniu, Pawłowicach, Trzebini, Chrzanowie, Niemodlinie, Grodkowie, Obornikach Śląskich, Tuchowie i Dąbrowie Tarnowskiej. Inwestycja ma wzmocnić infrastrukturę dystrybucyjną, poprawić jakość dostaw energii, a także wesprzeć rozwój OZE. Umowy o dofinansowanie podpisali w obecności wiceministra klimatu Krzysztofa Bolesty m.in. prezes NFOŚiGW Dorota Zawadzka-Stępniak, wiceprezes Energi-Operator Marek Pszonka i prezes Tauronu Dystrybucji Leszek Kosiorek. Grupa Energa to jedna z czterech największych grup energetycznych działających w Polsce. Jej sieć dystrybucyjna ma obecnie 200 tysięcy kilometrów, obejmując około jednej czwartej kraju i zasilając ok. 3,4 miliona klientów. Od 2020 r. Grupa Energa należy do Grupy Orlen. Tauron Polska Energia to spółka holdingowa kierująca grupą kapitałową działającą w obszarze wytwarzania, dystrybucji i sprzedaży energii. Koncern należy do największych firm w kraju - jest największym dystrybutorem prądu w Polsce oraz jednym z czołowych jego producentów i sprzedawców.","https://tvn24.pl/biznes/z-kraju/ponad-500-milionow-z-kpo-dla-energi-i-tauronu-ministerstwo-zapowiada-wielkie-inwestycje-w-sieci-energetyczne-st8974364"
"2026-03-30","PAP","Czesi zdecydowali w sprawie rynku paliw. Rząd stawia na rezerwy","Rząd Czech na posiedzeniu w poniedziałek nie zdecydował się na interwencję na rynku paliw. Premier Andrej Babisz ponownie zaapelował do dystrybutorów, aby zmniejszyli marże na swoich stacjach. Rafinerie w Czechach dostaną ropę pożyczoną z rządowych rezerw. Ministrowie ponownie spotkają się w czwartek. Poniedziałkowe posiedzenie rządu poprzedziło spotkanie z przedstawicielami największych dystrybutorów paliw w Czechach, którym premier przedstawił swoje stanowisko w sprawie marż. Jego zdaniem powinny być niższe niż stosowane obecnie. Jako przykład, że można je obniżyć, podał ceny przy głównej autostradzie kraju, które po jego rozmowach z firmami paliwowymi zostały obniżone. Ministerstwo finansów analizuje zarówno kwestię ewentualnego wprowadzenia maksymalnej stawki marży, co zdaniem rządu może wpłynąć na cenę detaliczną paliw w Czechach, jak i możliwe ingerencje podatkowe. Wciąż w grze jest także wprowadzenie podwójnych cen dla samochodów z obcą rejestracją. Premier zapowiedział, że kolejne posiedzenie rządu dotyczące cen paliw odbędzie się w czwartek. Rząd stawia na ropę z rezerw Dzień wcześniej ma dojść do kolejnego spotkania z przedstawicielami firm paliwowych: MOL, OMV, Shell, EuroOil i Orlen. - Premier przedstawił nam pewne propozycje rządu i za dwa lub trzy dni ponownie omówimy, które z nich da się zrealizować - powiedział po spotkaniu prezes zarządu Orlenu Unipetrol Mariusz Wnuk. Zaprzeczył, jakoby dystrybutorzy wykorzystywali sytuację na Bliskim Wschodzie do nieproporcjonalnego podnoszenia cen. Taki zarzut postawił wcześniej Babisz.  - Stosujemy standardową politykę cenową, co oznacza, że staramy się oferować jak najbardziej konkurencyjne ceny, biorąc pod uwagę rynek detaliczny w Czechach, który jest bardzo konkurencyjny – stwierdził Wnuk. Rząd zdecydował w poniedziałek, że pożyczy krajowym rafineriom 100 tys. ton ropy z rezerw strategicznych. Ich zarząd zapewnił, że zaopatrzenie czeskiego rynku w paliwa jest normalne, paliw jest pod dostatkiem. Nie ma więc potrzeby gromadzenia zapasów benzyny i oleju napędowego. Z Pragi Piotr Górecki (PAP) ptg/ mal/","https://www.pap.pl/aktualnosci/czesi-zdecydowali-w-sprawie-rynku-paliw-rzad-stawia-na-rezerwy"
"2026-03-30","PAP","Magdalena Kamińska nową prezes Energi","Magdalena Kamińska, dotychczasowa wiceprezes Energi, została powołana na stanowisko prezesa, które obejmie 1 kwietnia br. - poinformowała Energa w komunikacie giełdowym. Wiceprezesem spółki został Przemysław Janiak. „Zarząd spółki Energa SA (...) informuje, że w dniu 30 marca 2026 roku Rada Nadzorcza Spółki podjęła uchwały o: powierzeniu, w miejsce dotychczasowej funkcji Wiceprezesa Zarządu ds. Finansowych, od 1 kwietnia 2026 roku Pani Magdalenie Kamińskiej funkcji Prezesa Zarządu Energa S.A. VIII Kadencji, powołaniu, od 1 kwietnia 2026 roku, Pana Przemysława Janiaka w skład Zarządu Spółki VIII kadencji i powierzeniu funkcji Wiceprezesa Zarządu” - przekazała Energa. Od 4 lutego 2025 roku Kamińska pełniła stanowisko wiceprezes Energi ds. finansowych. Jak poinformowała spółka, nowa prezes ma kilkunastoletnie doświadczenie w zarządzaniu finansami. Jest absolwentką Wydziału Ekonomii Uniwersytetu Gdańskiego, a karierę zawodową rozpoczynała w 2007 roku w międzynarodowych firmach audytorskich - EY i Deloitte. Z Grupą Energa związana jest od 2011 roku. Pełniła funkcję zastępcy dyrektora, a następnie dyrektora departamentu finansów. Uczestniczyła w strategicznych projektach inwestycyjnych, pozyskiwaniu finansowania dla Grupy, a także w integracji z Grupą Orlen. Od lipca 2024 roku pełniła funkcję wiceprezesa spółki Energa Wytwarzanie. Jest członkinią rady nadzorczej należącej do Grupy Energa spółki Baltic Service Offshore Solutions. Zasiada w Radzie Zarządzającej Polskiego Komitetu Energii Elektrycznej. Z kolei, jak poinformowała Energa, Przemysław Janiak to menedżer z kilkunastoletnim doświadczeniem zawodowym w sektorze energetycznym. Karierę rozpoczął w 2010 roku w EY, realizując projekty dla kluczowych podmiotów z branży energetycznej. Od 2016 roku związany z Grupą Kapitałową Orlen, gdzie odpowiadał za obszar strategicznych analiz inwestycyjnych i rynkowych oraz rynek mocy. Był zaangażowany w realizację inwestycji w bloki gazowo-parowe, morskie farmy wiatrowe, elektrociepłownie przemysłowe, farmy fotowoltaiczne oraz magazyny energii. Od 2020 roku współpracował z Grupą Energa w obszarze strategii, przygotowania i realizacji inwestycji w źródła gazowe, ciepłownicze oraz morską energetykę wiatrową. Jest absolwentem studiów ekonomicznych w Szkole Głównej Handlowej w Warszawie oraz studiów podyplomowych w zakresie morskiej energetyki wiatrowej na Politechnice Gdańskiej. Ukończył szereg kursów menedżerskich realizowanych przez m.in. Harvard Business School, NYU Stern School of Business i University of Oxford. Grupa Energa to jedna z czterech największych grup energetycznych działających w Polsce. Jej sieć dystrybucyjna ma obecnie 200 tys. km, obejmując mniej więcej 1/4 kraju i zasilając około 3,4 mln klientów. Od 2020 r. Grupa Energa należy do Grupy Orlen. (PAP) gkc/ mrr/ grg/","https://www.pap.pl/aktualnosci/magdalena-kaminska-nowa-prezes-energi"
