"data","zrodlo","tytul","tresc","link"
"2026-04-11","TVN24","Zmiana cen paliw w hurcie. Orlen podał nowe stawki","W sobotę Orlen obniżył hurtowe ceny paliw. Olej napędowy potaniał o 90 złotych, a benzyna o 21 złotych za metr sześcienny - wynika z danych opublikowanych przez koncern. To zmiana po wcześniejszym wzroście ceny oleju Ekodiesel o 7 złotych i spadku ceny benzyny Eurosuper 95 o 29 złotych za metr sześcienny.  Według cennika hurtowego Orlenu w sobotę Poprzednio, w piątek, Orlen w hurcie podniósł cenę oleju napędowego Ekodiesel o 7 zł, do 6 810 zł za metr sześc., obniżył natomiast   bezołowiowej Eurosuper 95 o 29 zł, do 5 386 zł za metr sześc. Od 31 marca na wszystkich stacjach w Polsce obowiązują ceny maksymalne paliw, wprowadzone w ramach rządowego pakietu regulacji  , mającego ograniczać wzrost cen tych produktów. Ceny te ustalane są w oparciu o średnią cenę hurtową tych produktów na rynku krajowym, powiększoną o akcyzę, opłatę paliwową, a także marżę sprzedażową w wysokości 0,30 zł za litr i  . Z opublikowanego w piątek w Monitorze Polskim obwieszczenia Ministra Energii wynika, że od soboty do poniedziałku cena maksymalna z uwzględnieniem VAT litra benzyny bezołowiowej 95 wynosić będzie 6,14 zł, benzyny bezołowiowej 98 - 6,73 zł za litr, a oleju napędowego - 7,68 zł za litr. Dla porównania, w piątek cena maksymalna z uwzględnieniem VAT dla benzyny bezołowiowej 95 wynosiła 6,17 zł, dla benzyny bezołowiowej 98 - 6,77 zł, a dla oleju napędowego - 7,66 zł za litr. Z kolei pierwszego dnia obowiązywania cen maksymalnych na paliwa, czyli 31 marca, litr benzyny bezołowiowej 95 kosztował 6,16 zł, benzyny bezołowiowej 98 - 6,76 zł, natomiast oleju napędowego - 7,60 zł, w każdym przypadku z uwzględnieniem VAT. Ceny maksymalne paliw Ministerstwo Energii ogłasza codziennym obwieszczeniem, przy czym obowiązują one od dnia następnego po publikacji w Monitorze Polskim, a w przypadku obwieszczenia przed dniami wolnymi od pracy i świętami - do najbliższego dnia roboczego włącznie. Wojna na Bliskim Wschodzie, po ataku USA i Izraela na   28 lutego, spowodowała wzrost notowań ropy naftowej na świecie, a także notowań paliw gotowych, co przełożyło się na ceny detaliczne tych produktów na stacjach, również w Polsce. W miniony wtorek USA i Iran uzgodniły dwutygodniowe zawieszenie broni. W piątek wydawany w Dubaju dziennik Gulf News informował, że z Zatoce Perskiej wciąż znajduje się 325 tankowców, które nie mogą opuścić regionu z powodu faktycznej blokady Cieśniny Ormuz, strategicznej dla morskiego transportu ropy naftowej z Bliskiego Wschodu. Armatorzy wstrzymują tam kolejne rejsy w obawie przed minami, które mogły zostać rozmieszczone w Ormuzie przez Iran. ""Kluczowe dla dalszego kierunku zmian cen paliw na rynku krajowym będą głównie efekty rozpoczynających się 11 kwietnia bezpośrednich rozmów między USA i Iranem"" - ocenili w piątek analitycy biura Reflex. Zaznaczyli przy tym, że jeśli podczas rozmów nie zostaną zerwane warunki porozumienia, w kolejnym tygodniu powinny utrzymać się obniżki cen paliw na stacjach. Według danych zebranych przez Reflex, od czasu wprowadzenia pakietu ""Ceny Paliwa Niżej"" średnie ceny paliw na stacjach kształtują się nieznacznie poniżej wyznaczanych codziennie przez Ministra Energii poziomów maksymalnych - benzyny są tańsze średnio o 4 gr, a olej napędowy o 8 gr na litrze.","https://tvn24.pl/biznes/z-kraju/orlen-obniza-hurtowe-ceny-paliw-11-marca-2026-nowe-stawki-ile-kosztuje-paliwo-w-hurcie-st8992936"
"2026-04-10","Bankier","Orlen koryguje ceny paliw: benzyna w dół, diesel lekko w górę","","https://www.bankier.pl/wiadomosc/Orlen-koryguje-ceny-paliw-benzyna-w-dol-diesel-lekko-w-gore-9111866.html"
"2026-04-10","Bankier","PGE: Tworzymy przestrzeń dla polskich firm","","https://www.bankier.pl/wiadomosc/PGE-Tworzymy-przestrzen-dla-polskich-firm-9111889.html"
"2026-04-10","Bankier","Orlen Neptun wraca nad morze. Gdańsk nowym centrum polskiego wiatru","","https://www.bankier.pl/wiadomosc/Orlen-Neptun-wraca-nad-morze-Gdansk-nowym-centrum-polskiego-wiatru-9111892.html"
"2026-04-10","Bankier","Ceny paliw znów poszły w górę. Autogaz nigdy nie był tak drogi","","https://www.bankier.pl/wiadomosc/Ceny-paliw-10-kwietnia-2026-Autogaz-nigdy-nie-byl-tak-drogi-9111920.html"
"2026-04-10","Bankier","Rekordowy tydzień na GPW. Piątkowy szturm banków na historyczne szczyty","","https://www.bankier.pl/wiadomosc/Rekordowy-tydzien-na-GPW-Piatkowy-szturm-bankow-na-historyczne-szczyty-9112192.html"
"2026-04-09","Bankier","Orlen tnie ceny w hurcie. Diesel i benzyna tanieją o niemal 150 zł","","https://www.bankier.pl/wiadomosc/Orlen-tnie-ceny-w-hurcie-Diesel-i-benzyna-tanieja-o-niemal-150-zl-9111174.html"
"2026-04-09","Bankier","Podatek od zysków Orlenu coraz bliżej. Znany ekonomista ostrzega: obniżka VAT na paliwo to błąd","","https://www.bankier.pl/wiadomosc/Podatek-od-zyskow-Orlenu-coraz-blizej-Znany-ekonomista-ostrzega-obnizka-VAT-na-paliwo-to-blad-9111273.html"
"2026-04-09","Bankier","ENERGA S.A.: Powołanie Członków Rady Nadzorczej Energa SA","","https://www.bankier.pl/wiadomosc/ENERGA-S-A-Powolanie-Czlonkow-Rady-Nadzorczej-Energa-SA-9111514.html"
"2026-04-09","Bankier","Skrajnie trudna sytuacja Azotów i JSW. Balczun mówi o ""walce o płynność""","","https://www.bankier.pl/wiadomosc/Skrajnie-trudna-sytuacja-Azotow-i-JSW-Balczun-mowi-o-walce-o-plynnosc-9111547.html"
"2026-04-09","Bankier","Miał być pokój, jest nerwowo. Czerwień na giełdach w Europie, ale WIG20 znów zielony","","https://www.bankier.pl/wiadomosc/Mial-byc-pokoj-jest-nerwowo-Czerwien-na-gieldach-w-Europie-ale-WIG20-znow-zielony-9111631.html"
"2026-04-09","PAP","Prof. Piątkowski: popieram wprowadzenie podatku od nadmiarowych zysków","Obniżka VAT i akcyzy na paliwo jest nieuzasadniona, bo subsydiuje konsumpcję - ocenił w Studiu PAP prof. Marcin Piątkowski. Jego zdaniem rząd mógłby odrobić część strat budżetu spowodowanych obniżką i poprawić stan finansów publicznych wprowadzając podatek od nadmiarowych zysków firm paliwowych. W środę premier Donald Tusk oświadczył, że rząd nie zamierza rezygnować z pakietu „Ceny Paliwa Niżej” w związku z rozejmem na Bliskim Wschodzie. W nocy z wtorku na środę USA i Iran zawarły porozumienie o zawieszeniu broni. Jego trwałość stoi jednak pod znakiem zapytania, a główną osią sporu pozostaje to, czy zawieszenie broni obejmuje Liban. Jak wskazał prof. Piątkowski, ekonomista, wykładowca Akademii Leona Koźmińskiego, są wątpliwości co do wiarygodności i siły rozejmu, a dalsze trwanie konfliktu i blokady cieśniny Ormuz będzie oznaczać coraz większe tarapaty dla światowej gospodarki. Jego zdaniem mimo obniżenia w Polsce VAT i akcyzy na benzynę oraz wprowadzenia cen maksymalnych inflacja będzie rosnąć. Przyznał, że nie popiera obniżki tych podatków, gdyż każdy miesiąc jej obowiązywania oznacza uszczuplenie wpływów do budżetu państwa o ok. 1,5 mld zł. – Ta decyzja jest nieuzasadniona, bo tak naprawdę subsydiuje konsumpcję i dodatkowo wpycha nas w stary model rynku motoryzacyjnego opartego o benzynę i diesel - powiedział. Prof. Piątkowski poparł natomiast ideę wprowadzenia podatku od nadmiarowych zysków spółek paliwowych. Jego wprowadzenie rozważa rząd, a według ministra finansów Andrzeja Domańskiego projekt ustawy w tej sprawie będzie gotowy w tym miesiącu. - Stan polskich finansów jest niedobry. (...) Dług publiczny w stosunku do PKB bardzo szybko rośnie. Kilka lat temu był poniżej 50 proc., teraz jest 60 proc. Do końca dekady może wzrosnąć nawet do 75 proc. PKB. Musimy znajdować sposoby jako państwo, żeby zwiększać dochody i żeby zmniejszać wydatki - zaznaczył. Jeżeli z politycznych powodów musieliśmy ceny benzyny obniżyć, to przynajmniej odróbmy część strat narzucając podatek na firmy (paliwowe, PAP) - myślę, że głównie Orlen - które na tej sytuacji nadzwyczajnej uzyskały więcej niż w standardowej działalności. Na pytanie, czy w tym roku można już zapomnieć o obniżce stóp procentowych, ekonomista ocenił, że obecnie nie ma do tego pola. Wskazał, że za wcześnie jest też na myślenie o podwyżce stóp. - Myślę, że część rynku uważa - i to widać po cenach instrumentów finansowych, które pokazują jakie są przewidywane stopy procentowe pod koniec roku - że te stopy procentowe będą musiały pójść do góry. Inni, w tym ja, uważają, że na podwyżkę stóp procentowych na pewno jest za wcześnie, choćby dlatego, że cały czas jest szansa na to, żeby konflikt w Zatoce Perskiej zażegnać jak najszybciej - powiedział. Podkreślił, że gospodarka funkcjonuje na wysokim poziomie niepewności związanym z wojną w Zatoce Perskiej, wojną na Ukrainie, zmieniającą się geopolityką, niepotrzebny jest więc dodatkowy szok w postaci podwyżki stóp. W czwartek Rada Polityki Pieniężnej zdecyduje o wysokości stóp procentowych. RPP w tym roku obniżyła stopy procentowe w marcu, o 25 pkt bazowych. W efekcie główna stopa procentowa NBP, stopa referencyjna, wynosi 3,75 proc. (PAP) kmz/ mmu/ know/","https://www.pap.pl/aktualnosci/gosc-studia-pap-prof-marcin-piatkowski-ekonomista-wykladowca-akademii-leona"
"2026-04-08","Bankier","Duże wahania cen na rynku paliwowym. W drodze większa obniżka cen","","https://www.bankier.pl/wiadomosc/Rozjazd-na-rynku-paliw-Ropa-gwaltownie-tanieje-a-Orlen-podnosi-ceny-hurtowe-9110444.html"
"2026-04-08","Bankier","Dwa światy na GPW: KGHM świętuje, Orlen boi się podatku od zysków","","https://www.bankier.pl/wiadomosc/Orlen-spada-o-6-4-proc-a-KGHM-rosnie-o-9-6-proc-WIG20-idzie-w-gore-o-3-2-proc-9110456.html"
"2026-04-08","Bankier","Orlen spada o 6,4 proc., a KGHM rośnie o 9,6 proc.; WIG20 idzie w górę o 3,2 proc. (popr.)","","https://www.bankier.pl/wiadomosc/Orlen-spada-o-6-4-proc-a-KGHM-rosnie-o-9-6-proc-WIG20-idzie-w-gore-o-3-2-proc-popr-9110465.html"
"2026-04-08","Bankier","Rynki świętują rozejm USA z Iranem. Ceny ropy ostro w dół, szczyt hossy na warszawskiej giełdzie","","https://www.bankier.pl/wiadomosc/Rynki-swietuja-rozejm-USA-z-Iranem-Ceny-ropy-ostro-w-dol-wzrosty-na-gieldach-9110407.html"
"2026-04-08","Bankier","ENERGOINSTAL S.A.: Zawarcie umowy znaczącej.","","https://www.bankier.pl/wiadomosc/ENERGOINSTAL-S-A-Zawarcie-umowy-znaczacej-9110934.html"
"2026-04-08","Bankier","Pożar ugaszony, mamy tryb risk-on. Warszawski Indeks Giełdowy najwyżej w historii","","https://www.bankier.pl/wiadomosc/Pozar-ugaszony-mamy-tryb-risk-on-Warszawski-Indeks-Gieldowy-najwyzej-w-historii-9110933.html"
"2026-04-08","PAP","Na rynek powrócił optymizm po ogłoszeniu zawieszenia broni na Bliskim Wschodzie","Na warszawski parkiet powrócił w środę optymizm, inwestorzy pozytywnie podchodzą do możliwości odblokowania cieśniny Ormuz. Na zamknięciu sesji WIG20, indeks największych spółek, wzrósł o 3,43 proc. do 3.533,95 pkt. Spośród spółek zniżkował tylko Orlen i Tauron. Z kolei indeks WIG po wzroście o 3,31 proc. do 129.200,67 pkt zakończył notowania na nowym historycznym maksimum. Poprzedni rekord, z 4 lutego, wynosił ok. 128.173 pkt. Dwutygodniowe zawieszenie broni USA i Iran zgodziły się w nocy z wtorku na środę na dwutygodniowe zawieszenie broni. Częścią postanowień dotyczących rozejmu, osiągniętego za pośrednictwem Pakistanu, jest ponowne otwarcie przez Teheran cieśniny Ormuz, ale irańska marynarka wojenna nadal grozi zniszczeniem statków próbujących przepłynąć przez cieśninę bez zgody Teheranu. Spośród największych spółek w Warszawie najmocniej wzrosły akcje KGHM, które zyskały niemal 10 proc. Drugie co do wielkości zwyżki zanotował mBank rosnąc o 9,41 proc., a trzecią spółką, która najmocniej zyskała jest Alior Bank, którego papiery zyskały 7,32 proc. Z kolei spadki zanotowały papiery Orlenu, który stracił 2,84 proc., i Tauronu ze zniżką o 1,90 proc. Zdaniem analityków Domu Maklerskiego Banku Ochrony Środowiska, sesja została zdominowana przez skokowe podniesienie apetytu na ryzyko i solidarną ze światem odpowiedź GPW na dwutygodniowy rozejm w wojnie na Bliskim Wschodzie. Według nich z perspektywy GPW ważne były również umocnienie metali i osłabienie dolara. Niemniej, finałowa zmiana WIG20 w największym stopniu była pochodną skorelowania indeksu z otoczeniem, gdzie niemiecki DAX zyskał niemal 5 procent, a Wall Street szukała zwyżek w kontekście kilkunastoprocentowego spadku ceny ropy.(PAP) pif/ drag/gn/","https://www.pap.pl/aktualnosci/na-rynek-powrocil-optymizm-po-ogloszeniu-zawieszenia-broni-na-bliskim-wschodzie"
"2026-04-07","Bankier","DM BOŚ obniżył rekomendację Alior Banku do ""trzymaj""","","https://www.bankier.pl/wiadomosc/DM-BOS-obnizyl-rekomendacje-Alior-Banku-do-trzymaj-9110159.html"
"2026-04-07","Bankier","Wojna goreje, Trumpowi puszczają nerwy, a Citrini informuje o oszustwach w Ormuz. Tymczasem WIG20 ze szczytem hossy","","https://www.bankier.pl/wiadomosc/Wojna-goreje-Trumpowi-puszczaja-nerwy-a-Citrini-informuje-o-oszustwach-w-Ormuz-Tymczasem-WIG20-ze-szczytem-hossy-9110230.html"
"2026-04-04","PAP","Kolejki na stacjach przy granicy. Niemcy przyjeżdżają do Polski po tańsze paliwo","Na stacjach paliw w Lubieszynie (pow. policki) w Wielką Sobotę nadal ustawiają się kolejki pojazdów z niemieckimi tablicami rejestracyjnymi. Benzyna i olej napędowy są w Polsce tańsze nawet 50 eurocentów za litr niż po drugiej stronie granicy. Masowa turystyka paliwowa z Niemiec obserwowana jest od środy, kiedy w Polsce obowiązywać zaczęły urzędowe maksymalne ceny benzyny i oleju napędowego, ustalane obwieszczeniem Ministra Energii. Dzień wcześniej (31 marca) rząd zdecydował o obniżeniu akcyzy (z 23 do 8 proc.) na paliwa. Na przygranicznych stacjach w okolicach Szczecina codziennie ustawiają się kolejki pojazdów z tablicami rejestracyjnymi z Meklemburgii – Pomorza Przedniego i Brandenburgii. To landy, z którymi sąsiaduje woj. zachodniopomorskie. W Wielką Sobotę na pięciu stacjach benzynowych przy DK10 w Lubieszynie, blisko przejścia granicznego, tankowali praktycznie tylko kierowcy z Niemiec. Przy każdym dystrybutorze czekały po dwa, trzy pojazdy. Na stacjach Orlen (są dwie, oddalone o 200 m) benzyna kosztowała 6,21 zł, diesel 7,79 zł, a benzyna 98-okatnowa 6,82 zł za litr. Na pobliskiej stacji CircleK Express „dziewięćdziesiątka piątką” również kosztowała 6,21 zł, benzyna 98 także 6,82 zł. Znacznie droższy był natomiast olej napędowy 7,87 zł. Na dwóch stacjach BP tankowanie kosztowało tyle samo: benzyna 95 za 6,21 zł, benzyna 98 za 6,82 zł, diesel 7,87 zł. Oznacza to, że zagraniczne koncerny paliwowe podniosły ceny do maksymalnego poziomu, ustalonego obwieszczeniem Ministra Energii, które obowiązuje od 4 do 7 kwietnia. Na stacjach BP zwykłego diesla oraz diesel ultimate oferowano w tej samej cenie 7,87 zł za litr. Na stacjach Orlen za 7,87 zł jest „wzmocniony” verva diesel, a standardowy olej napędowy za 7,79 zł. Tankujący w Lubieszynie mieszkańcy przygranicznego powiatu Vorpommern-Greifswald podkreślali, że paliwa w Polsce są nawet ponad 50 eurocentów tańsze niż w Niemczech. – Opłaca się przejechać nawet kilkadziesiąt kilometrów do granicy, bo na tankowaniu można zaoszczędzić z 30 euro. A przy okazji zrobić inne zakupy – mówili kierowcy z Pasewalku. Pan Piotr, Polak mieszkający z rodziną w Locknitz, ok. 10 km od granicy, w rozmowie z PAP podkreślił, że jego niemieccy sąsiedzi od lat tankują w Polsce. A teraz, kiedy ceny paliw poszły mocno w górę, Lubieszyn stał się jedną wielką stacją benzynową dla całego regionu Wyjaśnił, że w północno-wschodnich Niemczech benzyna 95 kosztuje, w przeliczeniu, ponad 9 zł, a diesel ponad 10 zł.Z tego też powodu od kilku dni ogromne kolejki obserwowane są na stacjach benzynowych np. w Świnoujściu. W piątek i w sobotę (w Niemczech Wielki Piątek jest dniem wolnym od pracy) tankujących było tak wielu, że blokowali ulicę prowadzącą do świnoujskiego tunelu, który łączy zachodnią, uzdrowiskową cześć miasta (wyspa Uznam) z prawobrzeżem (Wolin) i drogą S3. Wzmożony ruch na stacjach benzynowych widać także w Szczecinie i okolicznych miejscowościach, m.in. Przecławiu, Rosówku (DK13) i Kołbaskowie (A6) czy Gryfinie. W Skarbimierzycach przy DK10, kilka kilometrów od Lubieszyna, na stacji lokalnej sieci benzynę 95 tankowano w sobotę za 6,21 zł, natomiast olej napędowy za 7,81 zł. W Mierzynie, na mniejszej prywatnej stacji, tuż przy granicy ze Szczecinem, „dziewięćdziesiątka piątka” kosztowała 6,19 zł, benzyna 98 była za 6,79 zł, diesel za 7,77 zł, a diesel TIR za 7,76 zł. Zgodnie z obwieszczeniem Ministra Energii od soboty do wtorku włącznie litr benzyny bezołowiowej 95, z uwzględnieniem VAT, ma kosztować nie więcej niż 6,21 zł, benzyny 98 - 6,82 zł, a oleju napędowego - 7,87 zł. (PAP) tma/ mark/ sma/","https://www.pap.pl/aktualnosci/kolejki-na-stacjach-przy-granicy-niemcy-przyjezdzaja-do-polski-po-tansze-paliwo"
"2026-04-03","Bankier","ENERGA S.A.: Wykaz akcjonariuszy posiadających co najmniej 5% głosów na Nadzwyczajnym Walnym Zgromadzeniu Energa SA w dniu 2 kwietnia 2026 roku","Raport bieżący nr / 2026 Data sporządzenia: 2026-04-03 Skrócona nazwa emitenta ENERGA S.A. Temat Wykaz akcjonariuszy posiadających co najmniej 5% głosów na Nadzwyczajnym Walnym Zgromadzeniu Energa SA w dniu 2 kwietnia 2026 roku Podstawa prawna Art. 70 pkt 3 Ustawy o ofercie – wykaz akcjonariuszy posiadających co najmniej 5% liczby głosów na walnym zgromadzeniu Treść raportu: Zarząd Energa SA („Spółka"") zawiadamia, iż na Nadzwyczajnym Walnym Zgromadzeniu Spółki („NWZ”) w dniu 2 kwietnia 2026 roku, jedynym akcjonariuszem posiadającym co najmniej 5% głosów był ORLEN S.A., któremu przysługiwało 521 416 640 głosów z posiadanych akcji, co stanowiło 99,00% w liczbie głosów uczestniczących w NWZ i odpowiadało 93,28% ogólnej liczby głosów w Spółce. Podstawa prawna: Art. 70 pkt 3 Ustawy o ofercie - WZ lista powyżej 5% Current Report No. 18/2026 Date: 3 April 2026 Subject: List of shareholders holding at least 5% of votes at the Extraordinary General Meeting of Energa SA on 2 April 2026 Legal basis: Article 70 item 3 of the Act on Offerings – list of shareholders holding at least 5% of votes at the General Meeting The Management Board of Energa SA (”Company”) informs that the only shareholder holding at least 5% of votes at the Extraordinary General Meeting of the Company (“EGM”) held on 2 April 2026 was ORLEN S.A., entitled to 521,416,640 votes from the possessed shares, which represented 99.00% of the votes taking part in the EGM and constituted 93.28% of the total number of votes in the Company. ENERGA SPÓŁKA AKCYJNA (pełna nazwa emitenta) ENERGA S.A. Energetyka (ene) (skrócona nazwa emitenta) (sektor wg. klasyfikacji GPW w W-wie) 80-309 Gdańsk (kod pocztowy) (miejscowość) Grunwaldzka (ulica) (numer) +48 58 778 83 00 +48 58 778 83 99 (telefon) (fax) (e-mail) (www) 957-095-77-22 220353024 (NIP) (REGON) Data Imię i Nazwisko Stanowisko/Funkcja Podpis 2026-04-02 Michał Gołębiowski Wiceprezes Zarządu Energi SA 2026-04-02 Piotr Szymanek Wiceprezes Zarządu Energi SA","https://www.bankier.pl/wiadomosc/ENERGA-S-A-Wykaz-akcjonariuszy-posiadajacych-co-najmniej-5-glosow-na-Nadzwyczajnym-Walnym-Zgromadzeniu-Energa-SA-w-dniu-2-kwietnia-2026-roku-9109007.html"
"2026-04-03","Bankier","Litwa zatwierdza tymczasową obniżkę akcyzy na olej napędowy","- Z powodu wojny (na Bliskim Wschodzie - PAP) znacznie wzrosły ceny ropy, a szczególnie oleju napędowego. (…) Podczas gdy benzyna podrożała o około 30 centów (za litr - PAP), cena oleju napędowego wzrosła o około 50 centów, a może nawet więcej – powiedział minister finansów Kristupas Vaitiekunas. Wysokość obniżonego podatku akcyzowego będzie stanowiła kwotę równą dodatkowym dochodom uzyskiwanym przez państwo z wyższego podatku VAT na olej napędowy, który obowiązuje w kraju od stycznia. Powyższe poprawki, przedłożone rząd w piątek, Sejm ma rozpatrzyć w trybie pilnym, by zostały zatwierdzone do połowy kwietnia. W celu opanowania rosnących cen paliw litewski rząd zobowiązał już spółkę Orlen Lietuva do zmniejszenia zapasów ropy o 80 tys. ton i natychmiastowego skierowania ich na rynek. Rząd pracuje też nad stworzeniem narzędzi do monitorowania cen paliw oraz zmianami w przepisach dotyczących zakupu biopaliw. Dodatkowo zdecydowano, że od kwietnia do końca maja bilety kolejowe będą sprzedawane z 50-procentową zniżką, aby zachęcić mieszkańców do korzystania z alternatywnych środków transportu. Orlen Lietuva jest jednym z największych klientów KN Energies – operatora produktów energii płynnej i terminali LNG w Kłajpedzie. To strategiczna spółka na Litwie, obsługująca rafinerię ropy naftowej w Możejkach i terminal naftowy w Butyndze. Zatrudnia ponad 1,5 tys. osób. Z Wilna Aleksandra Akińczo (PAP) aki/ akl/","https://www.bankier.pl/wiadomosc/Litwa-zatwierdza-tymczasowa-obnizke-akcyzy-na-olej-napedowy-9109035.html"
"2026-04-03","PAP","Litwa zdecydowała ws. cen paliw. Będzie tymczasowa obniżka","Rząd Litwy podjął w piątek decyzję o obniżeniu podatku akcyzowego na olej napędowy w celu złagodzenia wzrostu cen paliw. Obniżka ma obowiązywać do 15 czerwca i zmniejszyć cenę litra paliwa o około 6 eurocentów. - Z powodu wojny (na Bliskim Wschodzie - PAP) znacznie wzrosły ceny ropy, a szczególnie oleju napędowego. (…) Podczas gdy benzyna podrożała o około 30 centów (za litr - PAP), cena oleju napędowego wzrosła o około 50 centów, a może nawet więcej – powiedział minister finansów Kristupas Vaitiekunas. Wysokość obniżonego podatku akcyzowego będzie stanowiła kwotę równą dodatkowym dochodom uzyskiwanym przez państwo z wyższego podatku VAT na olej napędowy, który obowiązuje w kraju od stycznia. Powyższe poprawki, przedłożone rząd w piątek, Sejm ma rozpatrzyć w trybie pilnym, by zostały zatwierdzone do połowy kwietnia. Rosnące ceny paliw W celu opanowania rosnących cen paliw litewski rząd zobowiązał już spółkę Orlen Lietuva do zmniejszenia zapasów ropy o 80 tys. ton i natychmiastowego skierowania ich na rynek. Rząd pracuje też nad stworzeniem narzędzi do monitorowania cen paliw oraz zmianami w przepisach dotyczących zakupu biopaliw. Dodatkowo zdecydowano, że od kwietnia do końca maja bilety kolejowe będą sprzedawane z 50-procentową zniżką, aby zachęcić mieszkańców do korzystania z alternatywnych środków transportu. Orlen Lietuva jest jednym z największych klientów KN Energies – operatora produktów energii płynnej i terminali LNG w Kłajpedzie. To strategiczna spółka na Litwie, obsługująca rafinerię ropy naftowej w Możejkach i terminal naftowy w Butyndze. Zatrudnia ponad 1,5 tys. osób. Z Wilna Aleksandra Akińczo (PAP) aki/ akl/ ppa/","https://www.pap.pl/aktualnosci/litwa-zdecydowala-ws-cen-paliw-bedzie-tymczasowa-obnizka"
"2026-04-03","Bankier","Wartość aktywów pod zarządzaniem Quercus TFI na koniec marca wyniosła 8,98 mld zł","","https://www.bankier.pl/wiadomosc/Wartosc-aktywow-pod-zarzadzaniem-Quercus-TFI-na-koniec-marca-wyniosla-8-98-mld-zl-9109061.html"
"2026-04-03","Bankier","Ceny paliw ostro w dół. Ale LPG jest najdroższy w historii","","https://www.bankier.pl/wiadomosc/Ceny-paliw-ostro-w-dol-Ale-LPG-jest-najdrozszy-w-historii-9109087.html"
